number,value,datetime_start,datetime_complete,duration,params_colsample_bytree,params_early_stopping_rounds,params_gamma,params_grow_policy,params_learning_rate,params_max_delta_step,params_max_depth,params_max_leaves,params_min_child_weight,params_reg_alpha,params_reg_lambda,params_subsample,state
0,1.8040889294143245,2026-02-12 23:42:56.156514,2026-02-12 23:43:15.518434,0 days 00:00:19.361920,0.9370943376576378,246,5.539244894443622,depthwise,0.027511893079356923,8,3,,0.3661020453667823,6.23771581766088e-08,2.1325288093068306,0.6807826226583794,COMPLETE
1,1.926696153299904,2026-02-12 23:42:56.157861,2026-02-12 23:43:27.914140,0 days 00:00:31.756279,0.5569875041108223,229,0.05499469163364079,depthwise,0.06334642412271554,4,5,,43.003350603044936,0.00015901765431549603,62.08010457443265,0.8054690697503106,COMPLETE
2,1.7542090674870148,2026-02-12 23:42:56.168926,2026-02-12 23:43:17.341581,0 days 00:00:21.172655,0.5917396282902946,635,9.271907927440585,lossguide,0.008512844606633941,9,9,37.0,2.0318283513557347,0.1576195461747932,16.95227998954036,0.8635212855406753,COMPLETE
3,1.8078620479351912,2026-02-12 23:42:56.170873,2026-02-12 23:43:22.706706,0 days 00:00:26.535833,0.7199922870630052,543,1.692137023179967,depthwise,0.021205180906057195,9,9,,0.2903890654668706,4.822671067627929e-07,8.5808796026527,0.7560707447115209,COMPLETE
4,1.7718103907074978,2026-02-12 23:42:56.175278,2026-02-12 23:43:15.107890,0 days 00:00:18.932612,0.8230984236808384,636,5.9392158899976835,depthwise,0.0234841782566957,0,10,,0.7267537697907629,0.06161888232248922,7.264919320699016,0.8254053207931867,COMPLETE
5,1.8422080976409347,2026-02-12 23:42:56.169388,2026-02-12 23:43:20.741503,0 days 00:00:24.572115,0.5969303225016889,292,4.138916559041866,depthwise,0.040955104410230384,1,4,,19.62879755049898,0.00016255613110230136,4.067361567389927,0.6142768507133567,COMPLETE
6,1.807234505365924,2026-02-12 23:42:56.169855,2026-02-12 23:43:20.114101,0 days 00:00:23.944246,0.7349564339184973,680,1.4098568268430722,depthwise,0.031173921406538206,6,3,,0.43676027679776463,2.0884374274562866e-06,61.106924901557875,0.8602007001587237,COMPLETE
7,1.771647357260198,2026-02-12 23:42:56.170239,2026-02-12 23:43:27.707543,0 days 00:00:31.537304,0.8658632191224758,592,3.5858571552505536,lossguide,0.012934852209776138,8,11,477.0,0.17946258198593362,0.6259213157771817,24.354118918753404,0.8997859381653566,COMPLETE
8,1.7886669248061924,2026-02-12 23:43:15.176830,2026-02-12 23:43:32.515546,0 days 00:00:17.338716,0.5633932449947657,344,9.826854242042934,depthwise,0.03153655863486912,9,3,,1.5038757128215865,1.0567320325861847e-07,0.1309986618285562,0.9716306212509934,COMPLETE
9,1.770106595278967,2026-02-12 23:43:15.587230,2026-02-12 23:43:42.527992,0 days 00:00:26.940762,0.8846798287313571,404,8.267991853820584,depthwise,0.005175273486123254,4,11,,0.8746307543761715,0.03403333572418799,0.630521946510854,0.9033169711308089,COMPLETE
10,1.7648604152838459,2026-02-12 23:43:17.401386,2026-02-12 23:43:41.737477,0 days 00:00:24.336091,0.9836986729888351,784,8.97114181892559,lossguide,0.005063825539018561,5,5,272.0,3.7644911595961412,2.9810331561164996e-06,41.083171057035834,0.9027686631685403,COMPLETE
11,1.757827410963611,2026-02-12 23:43:20.184335,2026-02-12 23:43:38.812474,0 days 00:00:18.628139,0.7619531259331656,250,6.257689783411848,depthwise,0.01812390572289031,5,10,,1.0032490587424727,1.6452469586778775e-07,56.78783071951081,0.9511988395540403,COMPLETE
12,1.8316950232611298,2026-02-12 23:43:20.807176,2026-02-12 23:43:42.195685,0 days 00:00:21.388509,0.84285216069709,296,1.3397116004942655,depthwise,0.05488590283419998,4,8,,0.1314194482816652,0.00037410833758280264,0.3152095833621681,0.7884286074047033,COMPLETE
13,1.8293713846942097,2026-02-12 23:43:22.769264,2026-02-12 23:44:23.332851,0 days 00:01:00.563587,0.6529428367791914,565,0.1980315540188471,depthwise,0.010258523548871419,4,10,,7.9284419769918735,7.71819903450714e-06,48.5090163639432,0.9255649218968992,PRUNED
14,1.772506584514536,2026-02-12 23:43:27.781841,2026-02-12 23:43:50.237818,0 days 00:00:22.455977,0.9990105493956632,349,5.678552641935121,lossguide,0.01076399674231678,5,5,340.0,11.253888804835732,2.1384006643914315e-05,0.7871787520866532,0.8794933136824503,COMPLETE
15,1.7618172773065797,2026-02-12 23:43:27.980846,2026-02-12 23:43:54.114959,0 days 00:00:26.134113,0.6190166626633962,389,7.965231452657751,depthwise,0.005820218723347957,1,9,,9.342057161659843,0.09359185232763254,6.285972907731461,0.6766762030127788,COMPLETE
16,1.82119548994498,2026-02-12 23:43:32.577877,2026-02-12 23:44:55.480411,0 days 00:01:22.902534,0.6943521520904048,468,0.47128231191109204,depthwise,0.00652312687029131,10,10,,0.22699354504993643,0.6701597555090018,12.908295083264797,0.6357397426865801,PRUNED
17,1.7650413424034141,2026-02-12 23:43:38.899376,2026-02-12 23:44:07.823641,0 days 00:00:28.924265,0.6503693128661834,788,9.66327165032333,lossguide,0.005162004756648271,10,7,11.0,5.902439080925765,0.04170900590737786,0.011434142611198959,0.5013978496665622,COMPLETE
18,2.9682672440035827,2026-02-12 23:43:41.815154,2026-02-12 23:43:58.688720,0 days 00:00:16.873566,0.6361940225446685,424,7.528246407957872,lossguide,0.010265482228690104,3,8,1.0,4.0206460447502685,0.017188800284287258,0.17283566598488082,0.9578038590716977,COMPLETE
19,1.7712893571311668,2026-02-12 23:43:42.307288,2026-02-12 23:44:01.808477,0 days 00:00:19.501189,0.6695148767670962,456,7.96985990512747,lossguide,0.011034648834949095,6,12,13.0,4.3001453585755325,5.753802128598366,0.010250882019238386,0.9774595499920046,COMPLETE
20,1.7698249558913117,2026-02-12 23:43:42.623856,2026-02-12 23:44:08.666747,0 days 00:00:26.042891,0.6589423108971625,452,7.418219903981798,lossguide,0.01097585700170793,6,12,6.0,3.934100524544127,4.737270248829053,0.03835473824427447,0.5101019916641142,COMPLETE
21,1.807891414742973,2026-02-12 23:43:50.301628,2026-02-12 23:44:15.305456,0 days 00:00:25.003828,0.6475961303594633,455,6.9416275924371895,lossguide,0.011850542776755676,2,7,3.0,3.7066900907978684,3.3121939508887905,0.012853812896611107,0.9958875366462548,PRUNED
22,1.8090852242706492,2026-02-12 23:43:54.179008,2026-02-12 23:44:11.643824,0 days 00:00:17.464816,0.6691176115584923,475,7.070110693524853,lossguide,0.013188171665224277,7,12,3.0,2.960220877469673,0.002689796854572875,0.043473417691554966,0.9960633474630209,COMPLETE
23,1.7722422041240264,2026-02-12 23:43:58.753062,2026-02-12 23:44:23.877393,0 days 00:00:25.124331,0.6686904765795678,483,6.582362022764185,lossguide,0.01582971076443026,7,12,5.0,2.068890077977027,8.639997894838507,0.016840594374284784,0.5296441156034288,PRUNED
24,1.7894928815940085,2026-02-12 23:44:01.896084,2026-02-12 23:44:33.195996,0 days 00:00:31.299912,0.7755996148078624,731,6.563548325107338,lossguide,0.015535258911144198,7,7,143.0,1.782738956374285,0.003208566761025305,18.528601701744243,0.5460021070766232,PRUNED
25,1.7548923831676455,2026-02-12 23:44:07.890490,2026-02-12 23:44:28.716237,0 days 00:00:20.825747,0.5195237797805667,507,6.706375430373899,lossguide,0.014656779223740667,7,7,153.0,1.7067965261831266,6.166642254911206,19.275355318039264,0.9354407403558906,COMPLETE
26,1.7601222707188764,2026-02-12 23:44:08.733635,2026-02-12 23:44:26.756569,0 days 00:00:18.022934,0.5186280851195338,521,6.917065137529213,lossguide,0.016583743688288754,8,7,156.0,1.8431732451820422,1.018240132762578e-08,16.35820856198281,0.9968472423848682,COMPLETE
27,1.760069005882884,2026-02-12 23:44:11.708308,2026-02-12 23:44:30.900131,0 days 00:00:19.191823,0.8076234625038844,710,6.37533606725472,lossguide,0.016971881368097304,2,7,150.0,1.450552100623108,2.297889708781556e-08,21.34990951360645,0.9370013819833493,COMPLETE
28,1.758968865455852,2026-02-12 23:44:15.396283,2026-02-12 23:44:39.504635,0 days 00:00:24.108352,0.5223232990008381,552,8.698340345829605,depthwise,0.007628481566136571,0,9,,1.491309900276301,0.3207234794232049,18.130978481929734,0.6844524314020443,COMPLETE
29,1.7586904767123006,2026-02-12 23:44:23.409879,2026-02-12 23:44:46.375703,0 days 00:00:22.965824,0.5192327669601623,669,8.847682809934366,depthwise,0.007270952343105938,0,9,,1.6784065493684968,1.1464828020905966e-08,13.877082832620044,0.6890236512388268,COMPLETE
30,1.7604805863936797,2026-02-12 23:44:23.961855,2026-02-12 23:44:48.305796,0 days 00:00:24.343941,0.7922546266216882,365,8.734049423062201,depthwise,0.007493837270744465,2,9,,1.67103449239671,0.4736185521662517,17.26985765851194,0.7072012553669893,COMPLETE
31,1.7577702933889758,2026-02-12 23:44:26.842868,2026-02-12 23:44:49.937841,0 days 00:00:23.094973,0.5102274386736707,710,4.475909103500239,lossguide,0.008025089525138744,10,6,144.0,1.0945243422455713,1.5281149015914185e-08,18.536492614595687,0.9425634384211724,COMPLETE
32,1.764445292665412,2026-02-12 23:44:28.800715,2026-02-12 23:45:00.559141,0 days 00:00:31.758426,0.776716611827865,685,4.768804948407327,lossguide,0.007513030057784684,10,9,141.0,1.0970078971579067,0.676697228339821,17.530287067648644,0.848496529244015,COMPLETE
33,1.7650319508945609,2026-02-12 23:44:30.964264,2026-02-12 23:45:00.673402,0 days 00:00:29.709138,0.5114868503970634,586,4.209013427309005,lossguide,0.00734615559932912,10,9,123.0,0.884629640961565,0.38112296226409886,1.954856189277514,0.8457946914854944,COMPLETE
34,1.7632195978368976,2026-02-12 23:44:33.292870,2026-02-12 23:45:05.927650,0 days 00:00:32.634780,0.5087842912416497,618,4.793594405353485,lossguide,0.007962869828845339,10,9,217.0,0.8652009422570994,0.5527823938394838,99.6957029250841,0.8446183729701655,COMPLETE
35,1.7618679348539623,2026-02-12 23:44:39.568175,2026-02-12 23:45:08.293546,0 days 00:00:28.725371,0.5014680271158636,638,4.625968190346867,lossguide,0.007753559774905326,10,6,95.0,0.7593379975853042,0.7730402937920027,99.86860754397908,0.8351508117246875,COMPLETE
36,1.766607196203283,2026-02-12 23:44:46.443370,2026-02-12 23:45:12.048113,0 days 00:00:25.604743,0.7052835167284475,609,5.176640346249821,lossguide,0.007753570274951005,10,6,105.0,0.8848481381030756,0.45168803166188387,1.8071135012347044,0.8446304419513004,PRUNED
37,1.7764201720257013,2026-02-12 23:44:48.390542,2026-02-12 23:45:08.436891,0 days 00:00:20.046349,0.7039083334496739,632,5.245409180032173,lossguide,0.024783550667878355,10,6,98.0,0.8324155553910142,1.1857594716132591,2.138864572314789,0.8327537270352596,PRUNED
38,1.767936289415307,2026-02-12 23:44:49.988921,2026-02-12 23:45:15.469485,0 days 00:00:25.480564,0.5669056852351538,613,4.866631984219935,lossguide,0.008121731875009685,10,6,107.0,0.8201193700656366,8.784573918641873e-08,1.8214835229709685,0.8438254724858045,PRUNED
39,1.7617589667038969,2026-02-12 23:44:55.551424,2026-02-12 23:45:22.169706,0 days 00:00:26.618282,0.5705416479086854,625,4.93177719936614,lossguide,0.008912961400598308,9,6,91.0,0.8135130630842581,7.709825483674629e-08,91.21288071602903,0.8473754140841343,COMPLETE
40,1.7679722441017731,2026-02-12 23:45:00.655177,2026-02-12 23:45:25.922930,0 days 00:00:25.267753,0.5849638894027248,611,2.9727900743227704,lossguide,0.008607899597901847,9,6,92.0,0.41079054847680874,1.1765033867360557e-07,3.8281583969617543,0.9238203872211455,PRUNED
41,1.760733102033833,2026-02-12 23:45:00.759049,2026-02-12 23:45:26.907929,0 days 00:00:26.148880,0.5615842480155416,624,3.0534898636637404,lossguide,0.008897829307520934,9,6,90.0,0.46892879633749407,1.906785139790253e-07,79.05957498376218,0.9368174452606588,COMPLETE
42,1.7707749830360018,2026-02-12 23:45:05.989735,2026-02-12 23:45:25.831108,0 days 00:00:19.841373,0.5631245039989159,233,3.2878633258686234,lossguide,0.022108746201002748,9,6,78.0,0.47098443426245024,2.194632791382377e-07,2.1938797236634624,0.9401030377189928,PRUNED
43,1.7722308622450076,2026-02-12 23:45:08.361175,2026-02-12 23:45:27.918973,0 days 00:00:19.557798,0.571442896293186,222,2.934128341021485,lossguide,0.023288689367412938,9,6,83.0,0.4930738011947025,8.626083234042386e-08,2.7717449941217795,0.9337581687587061,PRUNED
44,1.7646197849993994,2026-02-12 23:45:08.511008,2026-02-12 23:45:31.028790,0 days 00:00:22.517782,0.5598424965874156,221,3.1578071334226374,lossguide,0.01933434915626647,9,8,216.0,0.44471542732836744,2.0203217991068616e-07,37.796822874509076,0.9420651501862667,COMPLETE
45,1.801709917577341,2026-02-12 23:45:12.137515,2026-02-12 23:45:40.297884,0 days 00:00:28.160369,0.5570393555689543,293,3.128929950896426,lossguide,0.021591764095312983,9,8,214.0,46.69140073291876,7.37439542742349e-08,35.27248220416996,0.7909929816393875,PRUNED
46,1.8068597827160193,2026-02-12 23:45:15.559000,2026-02-12 23:45:44.548063,0 days 00:00:28.989063,0.5962060321825681,216,2.766086142754824,lossguide,0.019799498304624158,9,8,214.0,46.10803609367465,3.429210713063442e-07,4.772032193075426,0.792480000852692,PRUNED
47,1.7686781321795162,2026-02-12 23:45:22.253880,2026-02-12 23:45:42.860743,0 days 00:00:20.606863,0.5963992430736291,268,5.796621392274945,depthwise,0.019805460873893736,8,8,,0.4637608257129023,4.387926494159961e-07,30.073239995461858,0.7970110074092283,PRUNED
48,1.7586893538336001,2026-02-12 23:45:25.913313,2026-02-12 23:45:46.808824,0 days 00:00:20.895511,0.5940048024294875,750,9.319745349307386,depthwise,0.01881665871362807,8,8,,0.5158351775434108,5.571463273566578e-07,31.6621382398227,0.7672276300483647,COMPLETE
49,1.7584507662518862,2026-02-12 23:45:26.015969,2026-02-12 23:45:45.119746,0 days 00:00:19.103777,0.53201225632648,749,9.181064524851916,depthwise,0.01924252120613933,8,8,,2.361571649345107,1.7318630332977793e-08,33.305341737321456,0.7562489103083438,COMPLETE
50,1.75483014446964,2026-02-12 23:45:26.968039,2026-02-12 23:45:49.129734,0 days 00:00:22.161695,0.5386683088617285,204,9.273859177303974,depthwise,0.006171611673133333,8,8,,2.4827130896610408,6.486614275467492e-07,34.8287733184708,0.7877532373431768,COMPLETE
51,1.766180060937427,2026-02-12 23:45:27.988096,2026-02-12 23:45:50.575960,0 days 00:00:22.587864,0.6027132306251379,751,5.9173932510224025,depthwise,0.0137279504908311,8,8,,2.5732178462024318,7.472710345460907e-07,36.03447971555351,0.7669860366625929,PRUNED
52,1.7606600165058688,2026-02-12 23:45:31.113843,2026-02-12 23:45:51.353829,0 days 00:00:20.239986,0.5357367235113939,753,9.562385926900141,depthwise,0.013635832083148568,8,11,,2.5343198402944194,9.314327706042898e-07,7.916724703344465,0.7833485996826818,COMPLETE
53,1.7575958403641014,2026-02-12 23:45:40.362216,2026-02-12 23:46:04.117567,0 days 00:00:23.755351,0.5371054650680028,746,9.476335674536662,depthwise,0.00589884510441076,8,11,,2.8945269714919593,1.57267778300614e-06,9.259721431310064,0.745097987614522,COMPLETE
54,1.7572290942028679,2026-02-12 23:45:42.929775,2026-02-12 23:46:05.209373,0 days 00:00:22.279598,0.5367025199453445,664,9.415778008184573,depthwise,0.006322687768397222,8,11,,2.8210122257051657,2.0240136977672293e-08,9.936906115285751,0.8771955485225271,COMPLETE
55,1.7556860227229043,2026-02-12 23:45:44.646970,2026-02-12 23:46:08.152730,0 days 00:00:23.505760,0.5418080002125565,762,9.294388143131094,depthwise,0.006285847510182307,5,10,,2.8277572277588967,1.8134964785583008e-08,9.815903475200445,0.8833179562898174,COMPLETE
56,1.765062508618974,2026-02-12 23:45:45.200643,2026-02-12 23:46:04.235927,0 days 00:00:19.035284,0.5390439186919305,755,9.667973268500344,depthwise,0.03196907579359872,8,11,,2.4033563236519653,3.701994372563805e-05,9.20575659668669,0.7625146908196049,PRUNED
57,1.7626701546161632,2026-02-12 23:45:46.897689,2026-02-12 23:46:05.007368,0 days 00:00:18.109679,0.5340450353896543,773,8.30295784564207,depthwise,0.030535190016080484,5,11,,2.6539506879798163,2.766421434073336e-08,7.240591026163778,0.883478314105333,COMPLETE
58,1.7617988452949123,2026-02-12 23:45:49.215882,2026-02-12 23:46:08.153726,0 days 00:00:18.937844,0.535275513659644,714,9.862208248295953,depthwise,0.03158372639310317,7,10,,2.7516558348629325,2.9066363548321442e-08,8.873438882278776,0.8771456803160911,COMPLETE
59,1.7648391651398563,2026-02-12 23:45:50.675680,2026-02-12 23:46:10.036664,0 days 00:00:19.360984,0.5384828382267528,255,9.434315781017093,depthwise,0.037319528627939136,7,10,,1.17514475005477,3.08438347723881e-08,9.696163209330168,0.7287662002919618,PRUNED
60,1.7622559161460807,2026-02-12 23:45:51.439432,2026-02-12 23:46:09.658433,0 days 00:00:18.219001,0.5330245871861039,257,9.950207966921015,depthwise,0.033814284324835915,7,10,,6.225716888444864,2.8334580461442725e-08,11.097621858800492,0.8777352587209998,COMPLETE
61,1.7552115637534773,2026-02-12 23:46:04.229612,2026-02-12 23:46:26.691440,0 days 00:00:22.461828,0.5404355940944039,322,8.19810798732694,depthwise,0.005971787800143423,7,10,,1.1956059655949114,3.0333368729980166e-05,10.78197311077132,0.8751119291424682,COMPLETE
62,1.756590065936769,2026-02-12 23:46:04.349720,2026-02-12 23:46:27.263431,0 days 00:00:22.913711,0.7353500801779969,659,9.961849825496758,depthwise,0.006139439828327184,7,10,,1.2107565161237392,1.552993899254298e-06,10.949025544889768,0.8823441048962533,COMPLETE
63,1.7614100025556036,2026-02-12 23:46:05.088004,2026-02-12 23:46:45.841068,0 days 00:00:40.753064,0.8936167657543078,254,8.341424863680892,depthwise,0.005960422075093037,7,10,,15.51628869543032,2.3031128780733814e-06,55.05341574398631,0.7165171783987995,COMPLETE
64,1.763851286128459,2026-02-12 23:46:05.414088,2026-02-12 23:46:29.070783,0 days 00:00:23.656695,0.6157972956939438,657,8.033253202361177,depthwise,0.006210748875218455,7,4,,5.261613672610751,3.5198967045089697e-06,11.305299131282247,0.7226930247942235,PRUNED
65,1.7569283818318684,2026-02-12 23:46:08.219629,2026-02-12 23:46:33.197428,0 days 00:00:24.977799,0.6188062932126772,686,8.29049335383597,depthwise,0.005983052396230358,6,10,,5.927963768646508,2.834557965687374e-06,11.813439128721347,0.7399679802787815,COMPLETE
66,1.759693813464513,2026-02-12 23:46:08.255758,2026-02-12 23:46:33.836603,0 days 00:00:25.580845,0.8934054707422521,516,8.280518696048375,depthwise,0.005950885454330385,6,10,,5.7764555605254735,1.811844679273369e-05,11.401847924613541,0.8181141168680293,COMPLETE
67,1.758658624568199,2026-02-12 23:46:09.755105,2026-02-12 23:46:36.311151,0 days 00:00:26.556046,0.6185670574661258,659,8.241508832769568,depthwise,0.005993208682590918,6,10,,15.34361593057291,3.357635735589289e-06,52.991591247981226,0.7257114886415206,COMPLETE
68,1.7608712605307502,2026-02-12 23:46:10.124431,2026-02-12 23:46:30.514930,0 days 00:00:20.390499,0.6307515692818807,656,8.467178717151167,depthwise,0.0058452016752577095,6,4,,5.583953044810971,1.983937737691739e-06,26.334804084876936,0.8182004277106805,COMPLETE
69,1.7648016482447144,2026-02-12 23:46:26.757083,2026-02-12 23:46:49.958000,0 days 00:00:23.200917,0.9065712231492452,658,8.158363288260047,depthwise,0.005966973403860422,6,11,,5.344551379805943,4.62144968314136e-06,5.267462909634793,0.8946875632057298,PRUNED
70,1.7546235943817978,2026-02-12 23:46:27.350711,2026-02-12 23:46:49.867378,0 days 00:00:22.516667,0.621320103944222,661,8.264300383213737,depthwise,0.006366409826071094,6,10,,5.420348112229928,9.279860242268738e-06,51.43679233813689,0.9088472549856186,COMPLETE
71,1.761186077193548,2026-02-12 23:46:29.167243,2026-02-12 23:46:54.345485,0 days 00:00:25.178242,0.9536011794368235,509,8.55302355908427,depthwise,0.005517339811998597,6,10,,0.5964020604047144,0.00011832624778100495,5.096299199522762,0.8106057814019293,COMPLETE
72,1.761900946154595,2026-02-12 23:46:30.584552,2026-02-12 23:46:52.782789,0 days 00:00:22.198237,0.9213001330392236,309,9.034216689325069,depthwise,0.006786069032597511,6,10,,1.2718157507661971,4.2930108610997e-05,5.678881498250647,0.9108810619729265,PRUNED
73,1.759559768645252,2026-02-12 23:46:33.256216,2026-02-12 23:46:54.821755,0 days 00:00:21.565539,0.6163325269391728,694,7.688148456103068,depthwise,0.006784847324062708,6,10,,1.4232783645173082,1.667165112408597e-05,5.362321881593824,0.9623268081491015,COMPLETE
74,1.7575599211195927,2026-02-12 23:46:33.927975,2026-02-12 23:46:57.622643,0 days 00:00:23.694668,0.5804639925185942,336,7.426838768952814,depthwise,0.0050478366080668104,6,10,,12.626848840178058,0.0001582893758182194,4.497521647947525,0.9126394545216533,COMPLETE
75,1.7648885262653486,2026-02-12 23:46:36.379194,2026-02-12 23:47:09.456225,0 days 00:00:33.077031,0.8519844208834673,313,7.647063431845274,depthwise,0.006801529593091568,5,10,,0.6068451228535995,0.0003426716602795022,3.822252131557725,0.916762410607907,PRUNED
76,1.7580094226751044,2026-02-12 23:46:45.901837,2026-02-12 23:47:08.317811,0 days 00:00:22.415974,0.7379479758060682,412,7.750252824329414,depthwise,0.00535452212766452,5,9,,1.3062127017553984,9.42441774973413e-05,6.02368158250467,0.8982261317598179,COMPLETE
77,1.7583316401520195,2026-02-12 23:46:49.931577,2026-02-12 23:47:11.489768,0 days 00:00:21.558191,0.7274867920232628,428,7.658997967348456,depthwise,0.0068130169576055746,4,9,,0.6153497307412411,0.00013259151736521693,4.779966724479973,0.9077751194675463,COMPLETE
78,1.7556784347350407,2026-02-12 23:46:50.051676,2026-02-12 23:47:11.330599,0 days 00:00:21.278923,0.6368329065056826,575,7.7290705352489875,depthwise,0.006792353990321678,4,9,,8.182243536282154,6.0204500999482746e-05,23.861979454834245,0.9112969940641574,COMPLETE
79,1.7548795965308994,2026-02-12 23:46:52.850196,2026-02-12 23:47:16.558772,0 days 00:00:23.708576,0.7440107601875121,698,7.574536478355137,depthwise,0.005144797489664393,4,9,,3.515055334053847,0.00013496046733124236,22.90680784756382,0.9174684799653342,COMPLETE
80,1.7579700622224266,2026-02-12 23:46:54.439524,2026-02-12 23:47:18.558231,0 days 00:00:24.118707,0.8626791083433423,692,7.6959871366356,depthwise,0.0050884330368042,5,9,,7.657765512581225,8.194310293793618e-06,22.865786943820392,0.8617113297386475,COMPLETE
