number,value,datetime_start,datetime_complete,duration,params_colsample_bytree,params_early_stopping_rounds,params_gamma,params_grow_policy,params_learning_rate,params_max_delta_step,params_max_depth,params_max_leaves,params_min_child_weight,params_reg_alpha,params_reg_lambda,params_subsample,state
567,1.757349543507958,2026-02-13 20:53:03.860659,2026-02-13 20:53:26.329456,0 days 00:00:22.468797,0.6117883957412221,431,9.814920108506247,lossguide,0.018887847325892687,9,10,402.0,0.2701245706285199,5.371659541896398e-05,29.260906089607545,0.8269161649173139,PRUNED
568,1.7536932333523891,2026-02-13 20:53:08.190396,2026-02-13 20:53:36.067233,0 days 00:00:27.876837,0.6229993361161024,427,9.997514822028595,lossguide,0.006063917643645863,9,8,402.0,0.24531880483301188,5.287617148147871e-05,24.883395416273142,0.8261866947414309,COMPLETE
569,1.7528645919273396,2026-02-13 20:53:10.504671,2026-02-13 20:53:37.848075,0 days 00:00:27.343404,0.6230733305979057,427,9.990689945628079,lossguide,0.005979284213039647,9,8,398.0,0.2521877000979005,4.039322900780148e-05,25.052428712791812,0.8068106108706492,COMPLETE
570,1.7538207119438989,2026-02-13 20:53:18.785247,2026-02-13 20:53:49.547166,0 days 00:00:30.761919,0.6263821058202109,429,9.805078581976018,lossguide,0.005834803847253542,9,11,276.0,0.1923567179432041,4.6428060930082685e-05,23.90292157529078,0.8353680998632749,COMPLETE
571,1.7552987304444123,2026-02-13 20:53:26.424262,2026-02-13 20:53:53.076490,0 days 00:00:26.652228,0.623437522681633,425,9.875547380382994,lossguide,0.0060109699372091095,9,8,353.0,0.8257355253163641,4.306103220855852e-05,11.622663426715226,0.8377384775224834,PRUNED
572,1.7638135197730458,2026-02-13 20:53:28.271994,2026-02-13 20:53:48.228864,0 days 00:00:19.956870,0.6265400517666474,424,9.816346517642877,lossguide,0.05369178938669532,9,8,350.0,0.19335557027192174,2.24572602046338e-05,23.419825430490775,0.8058458219246298,PRUNED
573,1.7529810343782157,2026-02-13 20:53:31.178473,2026-02-13 20:53:57.835142,0 days 00:00:26.656669,0.6287905470550814,479,9.803995987483741,lossguide,0.0053018843663455405,9,8,351.0,0.19300256382977268,2.3056190266078433e-05,24.00544580991182,0.8055332128815476,COMPLETE
574,1.7562720135599803,2026-02-13 20:53:32.458757,2026-02-13 20:54:01.347462,0 days 00:00:28.888705,0.9216371777239455,283,9.776406263488242,lossguide,0.005916107706251312,9,8,352.0,0.1942551783394895,2.270144845734431e-05,11.596278093775014,0.8062285982727729,PRUNED
575,1.75460616302333,2026-02-13 20:53:36.157749,2026-02-13 20:54:06.772696,0 days 00:00:30.614947,0.6072591468932391,478,9.811586166523783,lossguide,0.005612123867011953,10,11,354.0,0.1865485590000528,9.124975043299212e-05,12.066371515262594,0.8084162170604526,PRUNED
576,1.7546289483981004,2026-02-13 20:53:37.941734,2026-02-13 20:54:04.185932,0 days 00:00:26.244198,0.6065040083615237,478,9.59772915670771,lossguide,0.005608451487297292,10,8,349.0,0.19652123193057403,2.3608569171594033e-05,12.28267727670502,0.8386315375470421,PRUNED
577,1.7525299269542685,2026-02-13 20:53:48.312902,2026-02-13 20:54:14.034452,0 days 00:00:25.721550,0.6327801075191459,482,9.589496586133025,lossguide,0.0055845075000248295,10,8,352.0,0.16828197896295843,8.774076260353422e-05,17.114775663295784,0.8146262897517291,COMPLETE
578,1.7563859134192588,2026-02-13 20:53:49.639604,2026-02-13 20:54:18.597101,0 days 00:00:28.957497,0.9093448222570736,480,9.529502498018752,lossguide,0.0053047552850235815,10,8,349.0,0.1615965826652115,8.551063144598267e-05,11.781486040290543,0.8137199032530005,PRUNED
579,1.753113454634115,2026-02-13 20:53:53.146440,2026-02-13 20:54:20.105018,0 days 00:00:26.958578,0.6055047053002282,479,9.57319404467882,lossguide,0.005305330749097672,10,8,346.0,0.1886864597150078,0.00010071558750045261,17.57165521610048,0.8140252644092634,COMPLETE
580,1.756623747604125,2026-02-13 20:53:57.893347,2026-02-13 20:54:25.024315,0 days 00:00:27.130968,0.605719143472969,467,9.508156017367012,lossguide,0.005596977641630836,10,8,366.0,0.1731901123304563,9.70239473404426e-05,1.9804308512533288,0.8137964020290219,PRUNED
581,1.7981700548319897,2026-02-13 20:54:01.443167,2026-02-13 20:55:18.152545,0 days 00:01:16.709378,0.6049698968172311,467,1.5545079486903086,lossguide,0.005534054469486753,10,8,329.0,0.161119465039572,8.735838260142392e-05,36.17346955780101,0.8156487478036933,PRUNED
582,1.753562724002619,2026-02-13 20:54:04.256084,2026-02-13 20:54:31.685207,0 days 00:00:27.429123,0.6457127840962157,464,9.60033863327587,lossguide,0.005290362937458675,10,8,368.0,0.15930872980587132,9.513748533412775e-05,38.75083481554852,0.8149988269414002,COMPLETE
583,1.7537717348005033,2026-02-13 20:54:06.864933,2026-02-13 20:54:35.351037,0 days 00:00:28.486104,0.7216705784847324,468,9.633341622716584,lossguide,0.005286244619664147,10,8,369.0,0.1614199959913648,0.00014617164716784463,37.12043356494512,0.8134011119442323,COMPLETE
584,1.7541780224739534,2026-02-13 20:54:10.429701,2026-02-13 20:54:38.710316,0 days 00:00:28.280615,0.6363812007659704,465,9.5538530558085,lossguide,0.0052790844149876665,10,8,439.0,0.16382913477573463,0.00011995630439138993,38.390099700059174,0.8155671435977431,COMPLETE
585,1.756990559910418,2026-02-13 20:54:14.124711,2026-02-13 20:54:33.246693,0 days 00:00:19.121982,0.6358627987973575,493,9.534623425509853,lossguide,0.028770397818932373,10,8,331.0,0.15989185289680663,0.00014713032195042556,16.23789612736794,0.816372721835103,PRUNED
586,1.753424477739776,2026-02-13 20:54:18.691959,2026-02-13 20:54:43.656942,0 days 00:00:24.964983,0.6451744302583764,493,9.583848776588429,lossguide,0.00525484899920166,10,8,437.0,0.16338245536949186,0.00019303274341612596,16.618707056788278,0.8168176702224653,COMPLETE
587,1.7543712481248757,2026-02-13 20:54:20.196126,2026-02-13 20:54:46.749839,0 days 00:00:26.553713,0.6451792622455667,463,9.586615572916024,lossguide,0.005589487309928121,9,8,327.0,0.1674650385938136,0.00016605596992305864,9.378989085495622,0.8178559195036059,COMPLETE
588,1.7595181949872924,2026-02-13 20:54:25.117220,2026-02-13 20:54:44.795387,0 days 00:00:19.678167,0.6429225662439065,491,9.608116173601111,lossguide,0.02867298511351258,9,8,331.0,0.23984066885307553,0.0001751215964040038,17.509774774233104,0.8159820362284823,PRUNED
589,1.7534325771666193,2026-02-13 20:54:31.775282,2026-02-13 20:54:59.898190,0 days 00:00:28.122908,0.6363242817892955,495,9.583594787484618,lossguide,0.005001082836074591,9,8,329.0,0.16185910130918815,0.00014168968847881315,16.111912692480004,0.8218866090651398,COMPLETE
590,1.753693224980104,2026-02-13 20:54:33.342009,2026-02-13 20:55:01.692805,0 days 00:00:28.350796,0.6474548564493912,491,9.63771766293771,lossguide,0.005251760156934682,9,8,333.0,0.2415715856354174,0.0001714411515403646,14.3738101222422,0.8354482786431207,COMPLETE
591,1.7547422432507775,2026-02-13 20:54:35.427445,2026-02-13 20:55:04.837741,0 days 00:00:29.410296,0.647410529166708,413,9.651531090669215,lossguide,0.006324587862363968,9,10,329.0,0.23799104107811156,3.5112119328256774e-05,14.4601963102944,0.8359714895771206,PRUNED
592,1.7535998448032146,2026-02-13 20:54:38.800877,2026-02-13 20:55:06.526703,0 days 00:00:27.725826,0.6470742752941514,503,9.716788821728038,lossguide,0.006351754675717099,9,8,326.0,0.24233370946713523,3.673880561747566e-05,15.338868323138733,0.8350870200852013,COMPLETE
593,1.7540179828135918,2026-02-13 20:54:43.733313,2026-02-13 20:55:11.993851,0 days 00:00:28.260538,0.6336311777942673,402,9.781825157950173,lossguide,0.005693120684018242,5,8,326.0,0.23318348239730416,1.653794054360724e-05,14.698327549197138,0.8358198774175465,COMPLETE
594,1.7556497516115306,2026-02-13 20:54:44.869274,2026-02-13 20:55:14.459050,0 days 00:00:29.589776,0.6327953188990965,452,9.81485348154773,lossguide,0.00558124692834862,9,10,385.0,0.31113399898827004,0.003702379861173965,9.61848892244646,0.8038902370462442,PRUNED
595,1.7527702397363454,2026-02-13 20:54:46.814498,2026-02-13 20:55:12.949874,0 days 00:00:26.135376,0.6886152747114946,401,9.827594772654198,lossguide,0.006331292222670219,9,8,226.0,49.428717532765035,3.340387206627954e-05,14.095801410940778,0.836519581746822,COMPLETE
596,1.7617688057249998,2026-02-13 20:54:59.963733,2026-02-13 20:55:22.376871,0 days 00:00:22.413138,0.6543596229295434,400,9.813651452247132,lossguide,0.006369727213446723,9,10,383.0,0.3105244615443359,1.6907909783129393e-05,0.29311410628077056,0.835171379863484,PRUNED
597,1.7542907461764596,2026-02-13 20:55:01.758199,2026-02-13 20:55:22.301873,0 days 00:00:20.543674,0.6315561314925273,412,9.27888691177439,lossguide,0.006244898722359405,9,8,317.0,0.29803133721194985,0.004699849905144171,18.874711260112885,0.8047779808851674,COMPLETE
598,1.7537909742628026,2026-02-13 20:55:04.938435,2026-02-13 20:55:24.515762,0 days 00:00:19.577327,0.6832753616252805,451,9.270891927704508,lossguide,0.005750068449267432,5,8,289.0,0.3034134653051806,1.791689502693784e-05,19.850132362742613,0.7979512825002428,COMPLETE
599,1.7559409067262162,2026-02-13 20:55:06.616911,2026-02-13 20:55:23.070589,0 days 00:00:16.453678,0.6901950369707445,448,9.32311963047347,lossguide,0.010480662683524943,10,8,384.0,0.316452091036274,1.6603243440227666e-05,20.108785962334004,0.8018118873128239,PRUNED
