number,value,datetime_start,datetime_complete,duration,params_colsample_bytree,params_early_stopping_rounds,params_gamma,params_grow_policy,params_learning_rate,params_max_delta_step,params_max_depth,params_max_leaves,params_min_child_weight,params_reg_alpha,params_reg_lambda,params_subsample,state
327,1.7540766587292895,2026-02-13 20:38:10.752946,2026-02-13 20:38:40.289670,0 days 00:00:29.536724,0.5911208233548015,800,8.855641849745586,lossguide,0.005282074641450796,8,7,470.0,0.17543056524110742,2.0426947973445365e-05,40.6622790608153,0.8152379684376027,COMPLETE
328,1.753585504341178,2026-02-13 20:38:12.387344,2026-02-13 20:38:40.644080,0 days 00:00:28.256736,0.595869498675993,461,9.119639522309365,lossguide,0.005276133390077095,8,7,357.0,0.1732502691118948,0.22389190272650936,34.024121165785644,0.8120036581689875,COMPLETE
329,1.7540785627228723,2026-02-13 20:38:14.806142,2026-02-13 20:38:43.252136,0 days 00:00:28.445994,0.6099270216897301,800,9.166603114175029,lossguide,0.0052133311073552105,8,7,472.0,19.604294709870178,1.7815056037085994e-05,33.78865961325314,0.8109783834187526,COMPLETE
330,1.7536474133470876,2026-02-13 20:38:22.115415,2026-02-13 20:38:51.101826,0 days 00:00:28.986411,0.594519631231075,407,9.102324119366806,lossguide,0.005251474930061303,9,7,359.0,0.16820720822747892,0.24550757417601593,33.80329014805716,0.8094175561969638,COMPLETE
331,1.7606017690936528,2026-02-13 20:38:30.538554,2026-02-13 20:38:56.709810,0 days 00:00:26.171256,0.5932380043178141,395,8.857393943109862,lossguide,0.005233599597474018,8,4,359.0,0.16509459570827853,0.4071898954089317,33.31035505858779,0.8107138244903882,PRUNED
332,1.761095062255127,2026-02-13 20:38:35.030415,2026-02-13 20:39:01.447670,0 days 00:00:26.417255,0.6116369021729542,379,9.096061225974523,lossguide,0.005009383456673945,8,4,485.0,0.1788438416731575,0.26838534157925137,33.153492774841695,0.8079731828839363,PRUNED
333,1.7533400123665661,2026-02-13 20:38:38.645640,2026-02-13 20:39:07.769729,0 days 00:00:29.124089,0.6007136566747852,405,9.089456349531606,lossguide,0.005008190959236686,8,7,466.0,0.1761071678993469,0.24856408708587435,33.3994636379231,0.8114292920836023,COMPLETE
334,1.7535422457635317,2026-02-13 20:38:40.362939,2026-02-13 20:39:10.450327,0 days 00:00:30.087388,0.6123731271042732,437,9.063776408316668,lossguide,0.005045534766221444,8,7,357.0,0.17587596025493551,1.3853958184300407e-05,32.925770904693486,0.8089707084025393,COMPLETE
335,1.7530618715173891,2026-02-13 20:38:40.747728,2026-02-13 20:39:09.821074,0 days 00:00:29.073346,0.6124308278703348,417,9.068222796058892,lossguide,0.005025909250648126,8,7,355.0,0.18157059133526668,3.726042329441619e-05,33.638810231082616,0.8112949225299041,COMPLETE
336,1.7535575063337945,2026-02-13 20:38:43.345615,2026-02-13 20:39:13.961170,0 days 00:00:30.615555,0.6037005177671844,424,9.128052084036543,lossguide,0.005006729529474176,8,7,359.0,0.17979335184620535,2.689061549558577e-05,34.361802948239294,0.8094026200158263,COMPLETE
337,1.7541498939363334,2026-02-13 20:38:51.173952,2026-02-13 20:39:21.787477,0 days 00:00:30.613525,0.6130907446996713,413,9.12571197374512,lossguide,0.005009571588162853,8,7,355.0,12.860679578808952,0.1754510234815431,33.37662768912063,0.8090584014524341,COMPLETE
338,1.7546008043809111,2026-02-13 20:38:54.588300,2026-02-13 20:39:23.750526,0 days 00:00:29.162226,0.6148859819009531,402,9.074956481873171,lossguide,0.005009226127104604,8,7,354.0,14.463553150412855,0.19039464979872614,33.321532926402064,0.8070271391348068,COMPLETE
339,1.753882190814941,2026-02-13 20:38:56.782545,2026-02-13 20:39:26.843471,0 days 00:00:30.060926,0.6064608497739863,412,9.208870917184662,lossguide,0.0050467065592291775,9,7,494.0,12.6297341820985,4.225191066134976e-05,33.64283130753545,0.8077964926637211,COMPLETE
340,1.7536752892549454,2026-02-13 20:39:01.517096,2026-02-13 20:39:33.236838,0 days 00:00:31.719742,0.5931646823740967,432,9.18519422859389,lossguide,0.005077451795327376,9,7,338.0,0.1891709203909675,4.828978401313667e-05,32.0172135927063,0.8095890568315236,COMPLETE
341,1.753679500479892,2026-02-13 20:39:07.860776,2026-02-13 20:39:38.807115,0 days 00:00:30.946339,0.6075179536019304,415,9.175991520351111,lossguide,0.005026623392326435,9,7,458.0,0.20378733729867343,4.7504394847282235e-05,34.08018952160859,0.8097910791312544,COMPLETE
342,1.7545052614760108,2026-02-13 20:39:09.928827,2026-02-13 20:39:42.166269,0 days 00:00:32.237442,0.6020287358683469,411,9.272018509188632,lossguide,0.005063385976634009,9,7,401.0,0.20552360017337037,5.489188686279669e-05,33.98487720281889,0.787531408881342,COMPLETE
343,1.7535810613800935,2026-02-13 20:39:10.537662,2026-02-13 20:39:41.900654,0 days 00:00:31.362992,0.6084845885730239,415,9.282587574998825,lossguide,0.005009533779358034,9,7,335.0,0.15448397595991972,0.16198232457870138,33.77674027371144,0.8055703719170367,COMPLETE
344,1.7544934697110726,2026-02-13 20:39:14.026854,2026-02-13 20:39:45.266553,0 days 00:00:31.239699,0.6099196566746217,427,9.09327150225344,lossguide,0.005060874675814222,9,7,330.0,0.20412027638188063,3.843314585901542e-05,32.723231467530454,0.788004732435793,COMPLETE
345,1.7542834516565975,2026-02-13 20:39:21.850877,2026-02-13 20:39:52.695926,0 days 00:00:30.845049,0.6046098734243855,435,8.988075085620613,lossguide,0.005034726316044627,9,7,339.0,0.20657992934775823,0.10095751136002716,32.3869189415982,0.7883493303275276,COMPLETE
346,1.755895643049294,2026-02-13 20:39:23.815522,2026-02-13 20:39:52.095167,0 days 00:00:28.279645,0.6054734383805268,438,9.35357339565701,lossguide,0.005008410836911471,9,7,331.0,0.20429823785888634,0.10067489839089734,3.4354830123473437,0.7893703388145453,PRUNED
347,1.7544125443638723,2026-02-13 20:39:26.931604,2026-02-13 20:39:57.523706,0 days 00:00:30.592102,0.6016049181898587,446,9.286166943649178,lossguide,0.005061934246765083,9,7,338.0,0.21736126449442347,0.09431931662775385,32.8984582237091,0.7898851327702932,COMPLETE
348,1.7542752816149558,2026-02-13 20:39:33.332009,2026-02-13 20:40:01.095377,0 days 00:00:27.763368,0.6036528381894473,443,9.337344707032031,lossguide,0.005019034460659208,9,7,344.0,0.1950055626574993,2.4266288029690984e-05,31.98308383104312,0.7855166771128186,COMPLETE
349,1.7544582294453182,2026-02-13 20:39:38.900607,2026-02-13 20:40:07.504761,0 days 00:00:28.604154,0.6087266637180917,436,9.339650427620812,lossguide,0.005017235321199101,9,7,342.0,0.198180206603964,5.254430635888598e-05,30.50410592919962,0.787934159503212,COMPLETE
350,1.753921164312688,2026-02-13 20:39:41.964913,2026-02-13 20:40:11.341032,0 days 00:00:29.376119,0.6057390284531108,433,9.445345747469831,lossguide,0.0050242104236332095,9,7,326.0,0.2056883947939578,5.005607528260772e-05,31.953687868622573,0.785537889893555,COMPLETE
351,1.754587874832065,2026-02-13 20:39:42.270668,2026-02-13 20:40:11.482584,0 days 00:00:29.211916,0.6060912341410298,439,9.499453457109025,lossguide,0.005099384342727283,9,7,334.0,0.21348790506218093,3.078521116905782e-05,28.797514602998152,0.7896719275987494,COMPLETE
352,1.7587771668452226,2026-02-13 20:39:45.329311,2026-02-13 20:40:11.551176,0 days 00:00:26.221865,0.6051462281327793,441,9.39373760002805,lossguide,0.005012823013045102,9,7,340.0,0.20043262609073567,4.764823502209891e-05,0.0677868939532112,0.7945070826584654,PRUNED
353,1.7521621654600716,2026-02-13 20:39:52.168300,2026-02-13 20:40:20.506711,0 days 00:00:28.338411,0.6334006821227435,455,9.484379522322527,lossguide,0.005017216447066324,9,7,341.0,0.18086652082989604,2.8034080374296323e-05,27.660457370407904,0.80015712893305,COMPLETE
354,1.7523658116774374,2026-02-13 20:39:52.764593,2026-02-13 20:40:20.841653,0 days 00:00:28.077060,0.6387479391261626,453,9.61933374416003,lossguide,0.0052576147586352595,9,7,313.0,0.17353048448398334,4.203268134921817e-05,28.60513683593381,0.7997314286299276,COMPLETE
355,1.7536095650213503,2026-02-13 20:39:57.591724,2026-02-13 20:40:25.824971,0 days 00:00:28.233247,0.5981123381829996,419,9.47312814411992,lossguide,0.005285500452951773,9,7,367.0,0.1757194385861009,9.531096633417343e-05,27.432466454946155,0.801176837479725,COMPLETE
356,1.752209478691293,2026-02-13 20:40:01.160672,2026-02-13 20:40:28.778892,0 days 00:00:27.618220,0.6201839796370356,421,9.560557935333867,lossguide,0.005292636643031523,9,7,311.0,0.18693740223482713,4.14387359628017e-05,27.18632739882893,0.8011270542234908,COMPLETE
357,1.7528792751479578,2026-02-13 20:40:07.595709,2026-02-13 20:40:34.853784,0 days 00:00:27.258075,0.6262849137573686,419,9.56098343938656,lossguide,0.005338226659115662,9,7,367.0,0.18073591493378469,7.721384177857116e-05,26.342821458898104,0.8036731390233646,COMPLETE
358,1.7523312905614443,2026-02-13 20:40:11.460635,2026-02-13 20:40:39.710100,0 days 00:00:28.249465,0.6203598439876692,456,9.743042098445638,lossguide,0.00534153337928536,8,7,364.0,0.17626598140783595,8.543110065427572e-05,27.677495931157267,0.8016435667278499,COMPLETE
359,1.7538976968695639,2026-02-13 20:40:11.630245,2026-02-13 20:40:41.301236,0 days 00:00:29.670991,0.5956060808706668,461,9.120084792115177,lossguide,0.005332877191017745,9,7,457.0,0.1746355329126323,0.00010688842404097652,25.861348450984604,0.804576495329162,COMPLETE
360,1.75313596492627,2026-02-13 20:40:11.643462,2026-02-13 20:40:38.360601,0 days 00:00:26.717139,0.5950116223635677,416,9.593654128997287,lossguide,0.005416478891834336,9,7,367.0,0.1780178870153326,3.253763803404613e-05,27.00249931788429,0.801341343776286,COMPLETE
361,1.7526350135115538,2026-02-13 20:40:20.614119,2026-02-13 20:40:49.079255,0 days 00:00:28.465136,0.6430775777977328,462,9.639757249600468,lossguide,0.00532107131733373,9,7,367.0,0.17519497801268905,0.24226001549142984,27.374650619148106,0.8016022005787464,COMPLETE
362,1.7528320108150603,2026-02-13 20:40:20.935507,2026-02-13 20:40:48.482345,0 days 00:00:27.546838,0.6337225710263865,464,9.819961326411397,lossguide,0.005375374893529832,10,7,368.0,0.2484886104417325,9.976729910555884e-05,25.91072720444301,0.8003523661837195,COMPLETE
363,1.7523750034251302,2026-02-13 20:40:25.920608,2026-02-13 20:40:54.439638,0 days 00:00:28.519030,0.6258683911999332,473,9.7794101429449,lossguide,0.005335860649343477,9,7,365.0,0.17926208322503076,0.0001217430143156681,25.517411183708287,0.8038648931546151,COMPLETE
364,1.7533194300780177,2026-02-13 20:40:28.843195,2026-02-13 20:40:56.352323,0 days 00:00:27.509128,0.6388903944063145,464,9.835687743608991,lossguide,0.005316265477974361,9,7,311.0,0.18207743136708932,0.00011254472481647467,26.800468189360686,0.800714824339158,COMPLETE
365,1.7527420226076023,2026-02-13 20:40:34.946129,2026-02-13 20:41:03.590730,0 days 00:00:28.644601,0.6341026346765134,463,9.99267305720223,lossguide,0.0053462575424813984,10,7,366.0,0.17414521839994032,9.440114968340386e-05,25.70990383991076,0.7997057098782656,COMPLETE
366,1.7525202672013453,2026-02-13 20:40:38.449138,2026-02-13 20:41:07.263968,0 days 00:00:28.814830,0.6341250742245214,463,9.890811573329193,lossguide,0.005327418904076451,9,7,364.0,0.17230747927378395,0.00015953139355295628,25.633356708829233,0.8011905539079123,COMPLETE
367,1.752280764896523,2026-02-13 20:40:39.800572,2026-02-13 20:41:09.297592,0 days 00:00:29.497020,0.6220821678285964,456,9.73877093640514,lossguide,0.005375759938692373,10,7,367.0,0.18388421624163295,9.240831260009834e-05,25.65778118029536,0.7997623864219876,COMPLETE
368,1.7524503048378492,2026-02-13 20:40:41.391255,2026-02-13 20:41:21.752612,0 days 00:00:40.361357,0.6411082168667906,467,9.83344217106365,lossguide,0.00527573947558692,9,7,369.0,0.242808003128942,8.554399389062203e-05,26.16084601923856,0.7984036853068054,COMPLETE
369,1.7526135780751912,2026-02-13 20:40:48.578927,2026-02-13 20:41:17.353578,0 days 00:00:28.774651,0.6378010057955582,466,9.898424215127285,lossguide,0.005353783926214009,10,7,366.0,0.17688837635268354,0.00011856767692125247,25.542919763574726,0.7990173270286447,COMPLETE
370,1.752619470639568,2026-02-13 20:40:49.187239,2026-02-13 20:41:18.052618,0 days 00:00:28.865379,0.6356971481181379,482,9.890832862421695,lossguide,0.005353120059846716,10,7,368.0,0.23987584902988715,7.340983961968586e-05,25.51329155485928,0.7995396874724485,COMPLETE
371,1.76145630599337,2026-02-13 20:40:54.530640,2026-02-13 20:41:15.642952,0 days 00:00:21.112312,0.6428950495895291,473,9.978092653727686,lossguide,0.04427737608901197,10,7,365.0,0.2407877098242858,9.837596228973838e-05,24.66559938108497,0.7950398660446196,PRUNED
372,1.7549614047271926,2026-02-13 20:40:56.417595,2026-02-13 20:41:18.621687,0 days 00:00:22.204092,0.6419021997187369,475,9.90486476973767,lossguide,0.017803102447451508,10,7,317.0,0.24059604075816712,0.0001418520267699594,23.9752578564018,0.7985545389014536,COMPLETE
373,1.7535235871540513,2026-02-13 20:41:03.697295,2026-02-13 20:41:32.424758,0 days 00:00:28.727463,0.6344468726627095,471,9.79928419849151,lossguide,0.005356472810180122,10,7,309.0,0.24654667281606527,8.144346875506108e-05,23.043924230629905,0.7739337528272159,COMPLETE
374,1.7550112464542011,2026-02-13 20:41:07.335644,2026-02-13 20:41:34.800016,0 days 00:00:27.464372,0.6416350987504709,485,9.882127963323226,lossguide,0.005470109340593513,10,7,314.0,0.2607838439975597,0.00019436850281124774,23.754566368514798,0.7795667640978479,COMPLETE
375,1.7590597816335902,2026-02-13 20:41:09.360101,2026-02-13 20:41:30.827460,0 days 00:00:21.467359,0.6414851605329209,467,9.98369872501474,lossguide,0.029432276560574556,10,7,314.0,0.2475831171304233,0.00015975573027426378,22.918647170398465,0.7792476971563758,PRUNED
376,1.757576571740784,2026-02-13 20:41:15.722814,2026-02-13 20:41:37.064241,0 days 00:00:21.341427,0.6332010031682348,477,9.79306860472445,lossguide,0.020760215997720734,10,7,309.0,0.1842879625712504,0.00020297719946451892,21.27983749277204,0.7764903750760604,PRUNED
377,1.7539565687164373,2026-02-13 20:41:17.449983,2026-02-13 20:41:43.174632,0 days 00:00:25.724649,0.6368130851417381,483,9.816457496473461,lossguide,0.005472462870085622,10,7,384.0,0.18052923083496303,0.00014598506158731745,21.256604848301798,0.7729875961795846,COMPLETE
378,1.7548452319909629,2026-02-13 20:41:18.117499,2026-02-13 20:41:44.936144,0 days 00:00:26.818645,0.6334106265690106,477,9.99803672874711,lossguide,0.005488105852632242,10,7,384.0,0.23314695873885022,0.00016995188770241694,19.931831956810093,0.7792115701865291,COMPLETE
379,1.753705093537724,2026-02-13 20:41:18.686966,2026-02-13 20:41:44.618349,0 days 00:00:25.931383,0.6352407205380737,453,9.87043039481521,lossguide,0.005449292055940336,10,8,385.0,0.18267945360315715,0.00017505612973553868,20.622745344624285,0.7757414081285019,COMPLETE
380,1.7539992628573853,2026-02-13 20:41:21.820312,2026-02-13 20:41:48.834201,0 days 00:00:27.013889,0.6323184998177929,485,9.767776022816888,lossguide,0.005458981112439578,10,8,379.0,0.22675946519280296,0.00016734773537948716,22.01890506692785,0.780471783824868,COMPLETE
381,1.7540648604828333,2026-02-13 20:41:30.896893,2026-02-13 20:41:59.192212,0 days 00:00:28.295319,0.6318047087311495,456,9.783951394339214,lossguide,0.005427350706062869,10,8,384.0,0.22627539414410716,7.599219496872849e-05,20.164869592832382,0.7726030953560215,COMPLETE
382,1.7545192145718789,2026-02-13 20:41:32.493319,2026-02-13 20:42:01.050243,0 days 00:00:28.556924,0.631089805468441,483,9.767350284429373,lossguide,0.005495946157732922,10,8,384.0,0.22764224620790838,0.0002671747347085624,18.869962225373044,0.7693820331982258,COMPLETE
383,1.754099543827096,2026-02-13 20:41:34.889843,2026-02-13 20:42:04.026549,0 days 00:00:29.136706,0.6308003981721437,455,9.750821868529188,lossguide,0.005416695418829288,10,8,386.0,0.2273398314237046,7.644148113645913e-05,21.497061931026938,0.7763203879427244,COMPLETE
384,1.7536439107276973,2026-02-13 20:41:37.133638,2026-02-13 20:42:05.013381,0 days 00:00:27.879743,0.6262155855905942,454,9.767320215219632,lossguide,0.0053673686502337175,10,8,382.0,0.2244671369617731,0.00037008345689896945,19.83356726881658,0.7959479960383571,COMPLETE
385,1.767590419934926,2026-02-13 20:41:43.239177,2026-02-13 20:42:03.369242,0 days 00:00:20.130065,0.6295105444187109,455,9.70633537825282,lossguide,0.06387454210744342,10,8,375.0,0.22748318676485246,8.171599505613804e-05,18.532768275700924,0.7950850081086261,PRUNED
386,1.7534815867690006,2026-02-13 20:41:44.690488,2026-02-13 20:42:11.791611,0 days 00:00:27.101123,0.6258488804698318,457,9.686234126401716,lossguide,0.005425308612254091,10,7,297.0,0.22202843303996705,7.493019752244357e-05,19.0566247580261,0.7986014696731927,COMPLETE
387,1.7527725974247061,2026-02-13 20:41:45.048967,2026-02-13 20:42:11.913972,0 days 00:00:26.865005,0.6521228520850563,456,9.697342451393826,lossguide,0.005405175225217747,10,7,366.0,0.22501810803622582,0.0002937986794131851,18.856835295853923,0.7978511746786545,COMPLETE
388,1.7533083813597656,2026-02-13 20:41:48.903238,2026-02-13 20:42:17.418891,0 days 00:00:28.515653,0.6506561554849949,503,9.666574695375619,lossguide,0.005387960372833385,10,7,300.0,0.22582878756063007,7.596622264759837e-05,26.832736291109505,0.794606896720826,COMPLETE
389,1.7535498233608495,2026-02-13 20:41:59.260685,2026-02-13 20:42:30.278174,0 days 00:00:31.017489,0.6556497918967696,506,9.681065599842224,lossguide,0.005384475224481438,10,7,297.0,0.26473651998413866,0.0004225209600020928,25.373530263867373,0.7963740578977635,COMPLETE
390,1.7531954157644543,2026-02-13 20:42:01.115740,2026-02-13 20:42:31.551755,0 days 00:00:30.436015,0.648927475417217,497,9.656421516400094,lossguide,0.00535620437808462,10,7,365.0,0.18867136186468245,8.456488103795822e-05,25.898614353569137,0.796931367217136,COMPLETE
391,1.7535754989516168,2026-02-13 20:42:03.442681,2026-02-13 20:42:33.955252,0 days 00:00:30.512571,0.6535209796198734,463,9.65387650691252,lossguide,0.00537033618594173,10,7,371.0,0.19066859578383477,0.0003794734573076257,26.20869285382751,0.7937152821277651,COMPLETE
392,1.753215002279275,2026-02-13 20:42:04.133461,2026-02-13 20:42:32.947499,0 days 00:00:28.814038,0.6498752631736859,502,9.640942830209006,lossguide,0.005310646227374341,10,7,364.0,0.1956207308486957,0.00038755059718877127,26.499761673397465,0.7956225210169714,COMPLETE
393,1.7535906714031055,2026-02-13 20:42:05.082882,2026-02-13 20:42:34.223821,0 days 00:00:29.140939,0.6505097599438865,465,9.616060714783035,lossguide,0.005589929240393425,10,7,301.0,0.27115382831821966,7.362477170505241e-05,26.46115520581981,0.7974090319899577,COMPLETE
394,1.752824876543634,2026-02-13 20:42:11.893214,2026-02-13 20:42:42.023248,0 days 00:00:30.130034,0.6477989245381116,501,9.677579349421169,lossguide,0.005636590273223922,10,7,301.0,0.2715524040518275,8.444361386153696e-05,26.078211123459994,0.799812138566185,COMPLETE
395,1.7537239709143493,2026-02-13 20:42:11.983337,2026-02-13 20:42:41.677761,0 days 00:00:29.694424,0.6498998349045619,495,9.608476496824945,lossguide,0.0056660279016468515,10,7,369.0,0.1922007174978032,0.00010577077154065812,15.343051826381386,0.7969803891360415,COMPLETE
396,1.752861191381597,2026-02-13 20:42:17.486502,2026-02-13 20:42:47.987965,0 days 00:00:30.501463,0.6528501317546197,494,9.635743001552237,lossguide,0.005695727869162501,10,7,367.0,0.2742302779424211,0.0001043448215893792,26.637826748467315,0.7984193335887916,COMPLETE
397,1.7529218925806176,2026-02-13 20:42:30.329835,2026-02-13 20:43:00.143324,0 days 00:00:29.813489,0.6492121154203991,466,9.571016543801592,lossguide,0.005591181025669971,10,7,368.0,0.19292296598315145,0.00012656240530960626,26.658393644208697,0.7987075980710168,COMPLETE
398,1.7531534712035257,2026-02-13 20:42:31.613806,2026-02-13 20:43:01.906506,0 days 00:00:30.292700,0.6499896507834373,511,9.544554019223547,lossguide,0.00570857473111991,10,7,368.0,0.19463380259916652,0.00011381612825907745,25.94483878872583,0.7989600827127588,COMPLETE
399,1.7590146695202062,2026-02-13 20:42:33.046906,2026-02-13 20:42:55.363086,0 days 00:00:22.316180,0.6501321973744437,497,9.992631260840811,lossguide,0.022786996576474074,10,7,396.0,0.19609391122818018,0.00010926807310157292,15.000021882127337,0.7966955894222195,PRUNED
400,1.7606896434158,2026-02-13 20:42:34.059107,2026-02-13 20:42:55.984360,0 days 00:00:21.925253,0.6468046561782348,497,9.989095238629336,lossguide,0.037009158308628914,10,7,396.0,0.2705870714368688,8.474059369189409e-05,14.957256422209538,0.7977726948121884,PRUNED
401,1.7547473065811685,2026-02-13 20:42:34.379813,2026-02-13 20:43:02.702857,0 days 00:00:28.323044,0.6463285772701253,502,9.938348683212215,lossguide,0.00570005286885324,10,7,368.0,0.1887172832964809,0.00010700816440777585,14.457943344737268,0.7859762399837005,COMPLETE
402,1.7545893206821768,2026-02-13 20:42:41.774262,2026-02-13 20:43:09.707881,0 days 00:00:27.933619,0.6631011164859647,512,9.93935875981744,lossguide,0.005703936291285736,10,7,366.0,0.15642440398984045,0.00011429936702038206,27.95738488719089,0.7864658461598217,COMPLETE
403,1.7547438733194953,2026-02-13 20:42:42.134819,2026-02-13 20:43:10.405025,0 days 00:00:28.270206,0.6674350847682575,493,9.99256226960678,lossguide,0.005643008035989399,10,7,347.0,0.282585172459194,0.00010829162393090597,24.988612297975326,0.7855072561568955,COMPLETE
404,1.7544169410388508,2026-02-13 20:42:48.055042,2026-02-13 20:43:15.928028,0 days 00:00:27.872986,0.6684499601598295,512,9.967126182593244,lossguide,0.005706533853607476,10,7,348.0,0.26956019064924464,0.00011473048201610518,14.89191434492282,0.787001948136123,COMPLETE
405,1.7541128318185772,2026-02-13 20:42:55.464242,2026-02-13 20:43:23.548999,0 days 00:00:28.084757,0.6728253999298016,497,9.58490291135909,lossguide,0.005681133563007466,10,7,348.0,0.2652111641887556,3.2493370990567214e-05,26.850309032452554,0.783547074160652,COMPLETE
406,1.7542400461573826,2026-02-13 20:42:56.123450,2026-02-13 20:43:24.919697,0 days 00:00:28.796247,0.6704280154607333,512,9.609756911586999,lossguide,0.005701723594500504,10,7,349.0,0.2657311444615727,3.507665849002686e-05,26.966573243665007,0.7867814495717689,COMPLETE
