number,value,datetime_start,datetime_complete,duration,params_colsample_bytree,params_early_stopping_rounds,params_gamma,params_grow_policy,params_learning_rate,params_max_delta_step,params_max_depth,params_max_leaves,params_min_child_weight,params_reg_alpha,params_reg_lambda,params_subsample,state
246,1.7538880764700036,2026-02-12 23:54:45.066854,2026-02-12 23:55:08.587188,0 days 00:00:23.520334,0.5490451598920747,782,8.870670611987661,depthwise,0.005405285734888283,8,7,,2.6862389712168473,1.3260641647675102,41.575193819013705,0.8187928884241479,COMPLETE
247,1.7543296055067992,2026-02-12 23:54:48.669914,2026-02-12 23:55:12.013852,0 days 00:00:23.343938,0.5009627817267072,782,8.75831445524255,depthwise,0.0052763585526923815,8,7,,0.3129936194393522,1.5232058408306575,24.585224912200417,0.8156980622253027,COMPLETE
248,1.7537610344012136,2026-02-12 23:54:53.655124,2026-02-12 23:55:16.565431,0 days 00:00:22.910307,0.5543355864799402,782,8.848049492486547,depthwise,0.005239005620342675,8,7,,2.5982179823054765,1.7450712706978029,26.39508460319153,0.8153014747931208,COMPLETE
249,1.7553415149476295,2026-02-12 23:54:56.964142,2026-02-12 23:55:20.845223,0 days 00:00:23.881081,0.5553766735279962,779,8.949075164504771,depthwise,0.006395526346002849,8,7,,2.6991599766410226,1.5946421430461155,66.33338636936405,0.734344431800538,COMPLETE
250,1.874460890984698,2026-02-12 23:55:02.403156,2026-02-12 23:55:33.951352,0 days 00:00:31.548196,0.5538980845116299,774,0.5824370957272693,depthwise,0.04955182001387544,8,7,,2.715564888728971,1.7315475742320925,42.82197960543598,0.7342594129443047,PRUNED
251,1.754602973477437,2026-02-12 23:55:05.653200,2026-02-12 23:55:28.932558,0 days 00:00:23.279358,0.5397276065323651,781,8.978365926728411,depthwise,0.005288962163812825,8,7,,0.15572022785594544,1.686269695893047,22.170579481597414,0.7327433437264121,COMPLETE
252,1.7541048556915955,2026-02-12 23:55:07.455398,2026-02-12 23:55:29.221526,0 days 00:00:21.766128,0.5539700024301722,782,9.008062553084654,depthwise,0.005261617677464857,8,7,,0.10018545301581021,1.6445980678323955,26.20729773633026,0.8207283460389221,COMPLETE
253,1.7556107035127757,2026-02-12 23:55:08.676442,2026-02-12 23:55:31.867133,0 days 00:00:23.190691,0.5005664148461976,782,9.02815204493807,depthwise,0.005276419100472702,8,7,,0.15898099246127143,0.7886303961431045,26.538433476376856,0.720524882130497,PRUNED
254,1.7543597902760826,2026-02-12 23:55:08.785944,2026-02-12 23:55:32.737192,0 days 00:00:23.951248,0.5446082822581463,771,8.973341489231567,depthwise,0.005232426426448254,8,7,,0.15450000038519263,0.889507026698501,25.839835456745075,0.7312253490979513,COMPLETE
255,1.7548532364479592,2026-02-12 23:55:12.101526,2026-02-12 23:55:34.242466,0 days 00:00:22.140940,0.5032363266397214,770,9.043137193995115,depthwise,0.005236233547213629,8,7,,0.3244523242993977,0.7918273095792784,24.84402677781472,0.8172241640273388,COMPLETE
256,1.75642042771802,2026-02-12 23:55:16.630987,2026-02-12 23:55:41.200720,0 days 00:00:24.569733,0.5007969831429956,771,8.886803576285475,depthwise,0.005163900019673191,8,7,,0.27945355016352136,0.8885562708076975,22.688239400016798,0.7135495448488391,PRUNED
257,1.7555503349172772,2026-02-12 23:55:20.909838,2026-02-12 23:55:45.389676,0 days 00:00:24.479838,0.5011019907890106,771,8.818276117959227,depthwise,0.005040633770510289,8,7,,0.32201171921535265,1.1864011231338154,19.169084495774058,0.7270673182672649,PRUNED
258,1.755476366243783,2026-02-12 23:55:29.001820,2026-02-12 23:55:51.662858,0 days 00:00:22.661038,0.5065338511007397,773,8.73881279037162,depthwise,0.005051863999806659,8,7,,0.302889973743112,0.8444042285080152,16.525661565127095,0.8183509885265294,COMPLETE
259,1.7535828389379204,2026-02-12 23:55:29.317674,2026-02-12 23:55:52.296736,0 days 00:00:22.979062,0.5489368955474226,768,8.779266509972944,depthwise,0.005079684244329191,8,7,,0.25308983621863995,0.8545327884817733,25.2223559756203,0.8172537883461899,COMPLETE
260,1.7553570265551042,2026-02-12 23:55:31.942687,2026-02-12 23:55:53.994396,0 days 00:00:22.051709,0.5010649418719769,770,9.032380897247355,depthwise,0.005083362035347199,8,7,,0.12228306832851313,0.8981708874302976,20.50244432459521,0.8188061509657515,COMPLETE
261,1.75556136901983,2026-02-12 23:55:32.812718,2026-02-12 23:55:55.684355,0 days 00:00:22.871637,0.5004727278134149,768,8.814057719763408,depthwise,0.005049041055841049,8,7,,0.289265086843473,0.8965544053110213,19.771429621678926,0.8188456762510633,PRUNED
262,1.7544942042219005,2026-02-12 23:55:34.019035,2026-02-12 23:55:56.539794,0 days 00:00:22.520759,0.500567962340017,744,8.810408705187395,depthwise,0.00507128462439382,8,7,,0.2930841362737251,0.9241865132613012,18.3271112721761,0.8141118151548561,COMPLETE
263,1.755361651327437,2026-02-12 23:55:34.324016,2026-02-12 23:55:57.005796,0 days 00:00:22.681780,0.5317177784929215,746,8.793926916353811,depthwise,0.005029608803112215,8,7,,0.24872932575190435,0.912614091521302,19.597035746211468,0.8168821530700062,COMPLETE
264,1.754614507996309,2026-02-12 23:55:41.284903,2026-02-12 23:56:04.274634,0 days 00:00:22.989731,0.5267881074772212,755,8.818907953373998,depthwise,0.005061281886990851,8,7,,0.2435016924840241,1.1475333329388449,27.05616198807977,0.8218698369195292,COMPLETE
265,1.755152927276531,2026-02-12 23:55:45.461586,2026-02-12 23:56:08.265277,0 days 00:00:22.803691,0.5331231057079513,749,8.798196202013552,depthwise,0.005100471962424025,8,7,,0.12963058870139438,1.1050619518885156,16.158145326663607,0.8195253349390045,COMPLETE
266,1.7543301909159295,2026-02-12 23:55:51.732396,2026-02-12 23:56:15.215010,0 days 00:00:23.482614,0.7790227831322565,745,9.069392020551632,depthwise,0.0053592343224943065,8,7,,0.12942082365630517,4.928976317132878e-06,26.88360156997757,0.8196494832221589,COMPLETE
267,1.7547334370687508,2026-02-12 23:55:52.382975,2026-02-12 23:56:16.855085,0 days 00:00:24.472110,0.5458756249883752,746,7.245554812858318,depthwise,0.00503179955812527,8,7,,0.10318048629978478,1.0479513507956528,27.85214939515272,0.8228115487860691,COMPLETE
268,1.7556009312461895,2026-02-12 23:55:54.081333,2026-02-12 23:56:17.189125,0 days 00:00:23.107792,0.5487374524194323,749,9.456462020099249,depthwise,0.005426904884968626,8,7,,0.23729801713939835,1.0888308292878972,29.05196421774577,0.703790197596759,PRUNED
269,1.7537558698736972,2026-02-12 23:55:55.761042,2026-02-12 23:56:16.529522,0 days 00:00:20.768480,0.54643017179887,746,8.528107972375345,depthwise,0.005464050044215701,8,7,,0.10409589828950179,1.2369769469444982,29.95399297178281,0.8253376204662528,COMPLETE
270,1.754611536242862,2026-02-12 23:55:56.642177,2026-02-12 23:56:19.869563,0 days 00:00:23.227386,0.5455020367847295,755,7.354392848497842,depthwise,0.005437471345848819,8,7,,0.10563135892429633,4.06784427053676e-06,28.345085289363084,0.8251264620112594,COMPLETE
271,1.755117753424228,2026-02-12 23:55:57.118717,2026-02-12 23:56:30.261814,0 days 00:00:33.143097,0.5462032872286643,756,7.267549884330883,depthwise,0.00548210459906173,8,7,,0.12587204695988466,5.526791726857616e-06,29.71764199221372,0.8293572840863923,COMPLETE
272,1.7552766003499662,2026-02-12 23:56:04.336901,2026-02-12 23:56:28.482905,0 days 00:00:24.146004,0.54614310100617,751,9.414281520518248,depthwise,0.0054079621994580955,8,7,,0.10568837536274653,1.5930481407445491,29.986755645076776,0.6996918214169243,COMPLETE
273,1.7546266899003875,2026-02-12 23:56:08.352802,2026-02-12 23:56:30.809186,0 days 00:00:22.456384,0.7886581068264066,758,9.47310814799641,depthwise,0.0054005376483142525,8,7,,0.1276085526059374,0.3077093738419869,29.907471873021098,0.8316360367398409,COMPLETE
274,1.7570485781868765,2026-02-12 23:56:15.282456,2026-02-12 23:56:40.027078,0 days 00:00:24.744622,0.830125800867851,758,7.259742089923004,depthwise,0.00546203931951227,8,7,,0.10332587870559748,2.7927396609111845e-06,27.47106434341225,0.8298847817316135,PRUNED
275,1.7532947087182482,2026-02-12 23:56:16.639403,2026-02-12 23:56:39.285576,0 days 00:00:22.646173,0.7552489893747383,745,9.386876030747173,depthwise,0.00549155182777751,8,7,,0.1078350002677923,5.78658059211283e-06,30.263461725190513,0.829998554476623,COMPLETE
276,1.7554963536272654,2026-02-12 23:56:16.966749,2026-02-12 23:56:39.352477,0 days 00:00:22.385728,0.8219672432932578,757,9.431476051372938,depthwise,0.005427788372599056,8,7,,0.10393748805526713,3.955034646635899e-06,29.424311404286822,0.8331236980078678,PRUNED
277,1.7553858576211847,2026-02-12 23:56:17.311778,2026-02-12 23:56:38.986715,0 days 00:00:21.674937,0.8095332122076462,753,9.118462428642424,depthwise,0.005555240600454033,10,7,,0.14534426523580918,1.158202838056273e-06,25.130185189313003,0.8337859068791721,COMPLETE
278,1.755316239104513,2026-02-12 23:56:19.933533,2026-02-12 23:56:45.525366,0 days 00:00:25.591833,0.7744519442544342,758,8.521736756082923,lossguide,0.005561666497504689,10,7,439.0,0.1222612292478814,2.648165277537594e-06,23.739283109698494,0.8338137835585455,COMPLETE
279,1.7550346462934874,2026-02-12 23:56:28.569783,2026-02-12 23:56:53.519121,0 days 00:00:24.949338,0.8013319014912629,758,9.122224325931098,lossguide,0.005629243888995548,8,7,453.0,0.10032807476923235,5.01808718377527e-06,22.43990673123121,0.8319386384305538,COMPLETE
280,1.7544838749933531,2026-02-12 23:56:30.355290,2026-02-12 23:56:56.334584,0 days 00:00:25.979294,0.7808517362026569,737,8.509871470357696,lossguide,0.005634776531987569,10,7,447.0,0.15056620277592178,3.2252611476613668e-06,23.974997652655432,0.8447734651887624,COMPLETE
281,1.7542867961577842,2026-02-12 23:56:30.874189,2026-02-12 23:56:56.049725,0 days 00:00:25.175536,0.7567014018907867,743,8.486810440978816,lossguide,0.00597820700832368,8,7,439.0,0.10208808743821239,3.4506772786925344e-06,23.683266988048263,0.8376908860089747,COMPLETE
282,1.7541849593445373,2026-02-12 23:56:39.075758,2026-02-12 23:57:02.376644,0 days 00:00:23.300886,0.7686992712003362,740,8.49639356391558,depthwise,0.006028230801033025,8,7,,0.13201592537131523,1.649790839068624,22.430482376999013,0.842195772452837,COMPLETE
283,1.7542900308169653,2026-02-12 23:56:39.426692,2026-02-12 23:57:04.973769,0 days 00:00:25.547077,0.5805686197350299,740,8.428480143108148,lossguide,0.006047710000869365,8,7,257.0,0.12412392805563266,2.5201305659305767e-06,22.31497169750917,0.8447903814884341,COMPLETE
284,1.7547487067453376,2026-02-12 23:56:39.437248,2026-02-12 23:57:00.446954,0 days 00:00:21.009706,0.7925649700932228,742,8.496225589259797,depthwise,0.0060610556424714615,8,7,,0.12099009484227867,5.9157021056227355e-06,37.54017779461168,0.8466933278622548,COMPLETE
285,1.7542111031151046,2026-02-12 23:56:40.187269,2026-02-12 23:57:05.347986,0 days 00:00:25.160717,0.7649655908481716,788,8.539757993132962,lossguide,0.006018028465416591,8,7,450.0,0.1002741006179398,5.580596367727262e-06,38.88985140952693,0.8438247537646245,COMPLETE
286,1.7546519385090058,2026-02-12 23:56:45.590406,2026-02-12 23:57:08.473219,0 days 00:00:22.882813,0.7656842157605002,739,8.504082827088691,depthwise,0.006039197193510618,8,7,,0.12149313360021317,2.0683633504415093,37.43336658401907,0.8463845583766967,COMPLETE
287,1.7546883481413351,2026-02-12 23:56:53.608103,2026-02-12 23:57:15.114930,0 days 00:00:21.506827,0.7535427318307958,739,9.81481893287481,depthwise,0.005955307649279434,8,7,,0.11833905376603603,1.8903996596426316,13.448168150453586,0.8454896528340506,COMPLETE
288,1.755217268243343,2026-02-12 23:56:56.119548,2026-02-12 23:57:20.407529,0 days 00:00:24.287981,0.7738732305514834,738,8.454218417668763,lossguide,0.006129787856912156,9,7,284.0,0.1252586827293623,2.084077655704885e-06,37.36649350090414,0.8486028058476153,COMPLETE
289,1.7561752859607367,2026-02-12 23:56:56.438158,2026-02-12 23:57:21.177762,0 days 00:00:24.739604,0.7714657112303619,733,8.45126251829783,lossguide,0.006017435480009158,8,7,279.0,0.11669522471496772,1.6416457737807287e-06,14.31582924174997,0.8456168560851821,PRUNED
290,1.754917397771437,2026-02-12 23:57:00.513128,2026-02-12 23:57:25.427686,0 days 00:00:24.914558,0.7517149935356016,739,8.170009956697777,lossguide,0.006034318192134811,9,7,283.0,0.4272295392826702,6.1808310555872105e-06,19.809230909132822,0.84308867640377,COMPLETE
291,1.7550285392588656,2026-02-12 23:57:02.442371,2026-02-12 23:57:27.072782,0 days 00:00:24.630411,0.757264506787908,739,8.481031116312126,lossguide,0.005966172132507215,8,7,265.0,0.12234721738444555,1.6145896621442374e-06,21.628604004844608,0.8418902433330812,COMPLETE
292,1.7543098545669291,2026-02-12 23:57:05.043211,2026-02-12 23:57:30.473632,0 days 00:00:25.430421,0.7580570016016845,732,8.505122353239692,lossguide,0.005999527297742258,8,7,275.0,0.11853542378152714,1.8640606581235108e-06,17.24175078970119,0.8447411923030129,COMPLETE
293,1.7546899201839543,2026-02-12 23:57:05.421050,2026-02-12 23:57:29.861075,0 days 00:00:24.440025,0.7643530656505516,707,8.486030217560458,lossguide,0.006067366510732434,9,7,277.0,0.10022728953342576,1.2812303904916252e-06,17.01676109004387,0.8445363850946704,COMPLETE
294,1.7553160738541076,2026-02-12 23:57:08.556966,2026-02-12 23:57:33.764906,0 days 00:00:25.207940,0.7568758652526056,712,8.272541664383281,lossguide,0.00599875726949382,9,7,285.0,0.10202349519420166,9.36376136593027e-06,16.950824695500586,0.8408325855439482,COMPLETE
295,1.7550352456912888,2026-02-12 23:57:15.200218,2026-02-12 23:57:38.615974,0 days 00:00:23.415756,0.7312980640414228,727,8.251856348293545,lossguide,0.006018069083585353,9,7,286.0,0.10201682884532542,6.324571238042692e-06,17.12977525096677,0.8422059152846985,COMPLETE
296,1.7554397352623978,2026-02-12 23:57:20.507451,2026-02-12 23:57:41.266325,0 days 00:00:20.758874,0.7280658718800463,783,8.297722787302034,lossguide,0.005806791178249104,8,7,376.0,0.11281545268239675,1.8277414360189846e-06,15.640209199098933,0.8531670627186607,PRUNED
297,1.7557571715768336,2026-02-12 23:57:21.269880,2026-02-12 23:57:41.661597,0 days 00:00:20.391717,0.7498800470453727,786,8.261741810738936,lossguide,0.005848869582293679,9,7,372.0,0.10232711638569356,9.05949485342961e-07,17.896557190281637,0.8551782337634349,PRUNED
298,1.7551340133157112,2026-02-12 23:57:25.514750,2026-02-12 23:57:43.290083,0 days 00:00:17.775333,0.7382490402626021,714,8.27692836080813,lossguide,0.005780873867636403,8,7,375.0,0.10890019812387688,9.128520459126566e-07,17.692448452327426,0.8583030580814157,COMPLETE
299,1.755280118377401,2026-02-12 23:57:27.146881,2026-02-12 23:57:43.357620,0 days 00:00:16.210739,0.7426053247513525,707,8.214970698481233,lossguide,0.005745566248641181,8,7,382.0,0.10050179415378892,0.07161712812830406,17.357403602768134,0.85754514118022,COMPLETE
300,1.755154374142684,2026-02-13 20:36:39.303686,2026-02-13 20:37:07.196038,0 days 00:00:27.892352,0.7655427992588237,725,7.957795524141682,lossguide,0.006393461976626745,0,8,170.0,0.13162872130718786,2.6548394222367275e-06,32.2174553519466,0.8268812521419571,COMPLETE
301,1.7559398870428513,2026-02-13 20:36:39.314060,2026-02-13 20:37:09.106949,0 days 00:00:29.792889,0.7674563328292661,724,8.038583627831331,lossguide,0.006370523919660633,8,8,185.0,0.13820800355333543,3.7809362055114855e-06,12.51331240418314,0.8269790377023182,PRUNED
302,1.7550685642808117,2026-02-13 20:36:39.321246,2026-02-13 20:37:03.878544,0 days 00:00:24.557298,0.7628609490828118,724,8.644727953598794,lossguide,0.006328160731252727,0,7,174.0,0.16149735000328866,5.003597038882662e-07,31.544127552194052,0.8704054058576748,COMPLETE
303,1.7566322273825585,2026-02-13 20:36:39.321476,2026-02-13 20:37:05.409042,0 days 00:00:26.087566,0.768493239338782,722,7.957063722050127,lossguide,0.00631720761099822,8,8,245.0,0.14102639142863815,1.071470205481678e-05,12.862311153307473,0.872764951345891,PRUNED
304,1.7558610393117458,2026-02-13 20:36:39.322483,2026-02-13 20:37:08.972216,0 days 00:00:29.649733,0.7442048308677194,723,7.887289098061789,lossguide,0.006357688893536665,8,8,242.0,0.13344879110415905,5.569062209774827e-07,31.16491310967805,0.8686173143224958,PRUNED
305,1.7557087453834392,2026-02-13 20:36:39.331423,2026-02-13 20:37:08.892258,0 days 00:00:29.560835,0.7592997389327943,725,8.016307641742664,lossguide,0.006398782222918546,0,8,187.0,0.15352298498796155,3.847049035531194e-06,21.755501393641914,0.8277516813313512,PRUNED
306,1.7803190336992027,2026-02-13 20:36:39.332205,2026-02-13 20:37:24.433096,0 days 00:00:45.100891,0.5907895264584059,723,2.255531771271049,lossguide,0.006529632991961826,0,7,240.0,0.14022631436701588,9.837941568087932e-06,30.51725089849047,0.868602579121767,PRUNED
307,1.7555589560658018,2026-02-13 20:36:39.332674,2026-02-13 20:37:07.282045,0 days 00:00:27.949371,0.7464924843597459,692,7.957220962069913,lossguide,0.006495774727649432,0,8,193.0,0.13208820927172876,9.593876185877871e-06,12.256071821156386,0.8652110104997314,PRUNED
308,1.7554370120665492,2026-02-13 20:37:03.996466,2026-02-13 20:37:31.565427,0 days 00:00:27.568961,0.7461892263238776,766,8.6365194666636,lossguide,0.0062455642446736575,8,8,421.0,0.1373948130925056,2.5872674797497966e-06,12.812001290028329,0.8268381705211022,PRUNED
309,1.7548340085681966,2026-02-13 20:37:05.515555,2026-02-13 20:37:36.212313,0 days 00:00:30.696758,0.5839959216070875,766,8.068214467266875,lossguide,0.0056916115445554685,8,8,417.0,0.13735249826215898,2.9178584742390695e-06,21.666166720379497,0.8306988871770652,COMPLETE
310,1.7539156536949483,2026-02-13 20:37:07.275028,2026-02-13 20:37:35.399559,0 days 00:00:28.124531,0.5841644309616065,766,8.610602308639168,lossguide,0.005680723219785145,8,7,416.0,0.13951573302294673,1.8509253464625284e-05,40.2439432102903,0.8330256970965011,COMPLETE
311,1.754393842719641,2026-02-13 20:37:07.340212,2026-02-13 20:37:33.609389,0 days 00:00:26.269177,0.584633032281574,766,8.621152963532445,lossguide,0.005630513106943993,8,7,404.0,0.14501688780391647,1.860152699380608e-05,21.913649231567216,0.8339550456211648,COMPLETE
312,1.753574363064172,2026-02-13 20:37:08.966353,2026-02-13 20:37:39.845086,0 days 00:00:30.878733,0.5844676784364549,436,8.629669143404856,lossguide,0.005698273296164442,8,7,410.0,0.14166005696769846,2.7669103714272334e-06,40.85633329820268,0.832527337773815,COMPLETE
313,1.7542087176682337,2026-02-13 20:37:09.044881,2026-02-13 20:37:36.113520,0 days 00:00:27.068639,0.5872686143715413,767,8.640390662184359,lossguide,0.005630355535426587,8,7,422.0,0.1164310704189817,0.4814764019978371,39.88942279637954,0.8296570716180474,COMPLETE
314,1.7594917538983408,2026-02-13 20:37:09.170267,2026-02-13 20:37:44.604571,0 days 00:00:35.434304,0.58067764380405,766,8.647587149171075,lossguide,0.005647863167486682,8,7,417.0,0.11482801797722351,0.5135541864175962,40.49204219065455,0.6013953846068303,PRUNED
315,1.753970143753537,2026-02-13 20:37:24.496706,2026-02-13 20:37:52.289263,0 days 00:00:27.792557,0.5804487209369639,763,8.622787725937359,lossguide,0.005605881600043698,8,7,412.0,0.11585876604057997,0.565311897056148,39.59136597720656,0.8315527684384361,COMPLETE
316,1.7636610365257703,2026-02-13 20:37:31.655828,2026-02-13 20:38:10.667793,0 days 00:00:39.011965,0.9497928789205404,789,5.175786290784174,lossguide,0.005607492513212557,8,7,353.0,0.11662076253714754,0.03631928578467571,40.578198543650664,0.8353045564221047,PRUNED
317,1.7536940688622267,2026-02-13 20:37:33.676607,2026-02-13 20:38:01.560963,0 days 00:00:27.884356,0.5770927718297691,790,8.774529047168702,lossguide,0.005615391502142329,8,7,468.0,0.11536482224973647,0.6289782105605821,41.59388823695122,0.8117300664664016,COMPLETE
318,1.7563676816757294,2026-02-13 20:37:35.485012,2026-02-13 20:38:12.315729,0 days 00:00:36.830717,0.5820011291307795,790,8.795193175175774,lossguide,0.005627364346871875,8,7,308.0,0.11100349093380844,1.9824296286611377e-05,2.4920999042808405,0.8169618093725369,PRUNED
319,1.7534425748672664,2026-02-13 20:37:36.194834,2026-02-13 20:38:05.813479,0 days 00:00:29.618645,0.5750601917445854,789,8.824560377109886,lossguide,0.0053027270577285755,8,7,358.0,0.11269236515391017,1.8668918231242877e-05,38.55985888103512,0.8122208146244467,COMPLETE
320,1.75792372782631,2026-02-13 20:37:36.272782,2026-02-13 20:38:09.549459,0 days 00:00:33.276677,0.9955498544207786,787,8.799418019761031,lossguide,0.00531259021359328,8,7,467.0,0.11534901146768714,0.3511291716714445,41.3711331997648,0.8128173792288509,PRUNED
321,1.7646145170767464,2026-02-13 20:37:39.911195,2026-02-13 20:38:22.042249,0 days 00:00:42.131054,0.5795327419016847,437,4.480249988922607,lossguide,0.0053103630414207395,8,7,471.0,0.1648221532697452,7.415536363793455e-06,42.625987349409364,0.8124232803543255,PRUNED
322,1.753701547260657,2026-02-13 20:37:44.697898,2026-02-13 20:38:14.717842,0 days 00:00:30.019944,0.5862910904528281,419,8.759361918994463,lossguide,0.00530021371793617,8,7,468.0,0.11593015732030082,1.3729049114998957e-05,40.432008497219066,0.814281084983864,COMPLETE
323,1.7869373740106647,2026-02-13 20:37:52.355487,2026-02-13 20:38:54.487755,0 days 00:01:02.132268,0.5949155757217546,789,4.438325578661377,lossguide,0.005306596111852625,8,7,473.0,0.16646831233123546,0.3298329060458287,42.36386824436879,0.5640286108376422,PRUNED
324,1.7533437943714778,2026-02-13 20:38:01.625408,2026-02-13 20:38:30.443193,0 days 00:00:28.817785,0.5885903566455146,426,8.89810773528025,lossguide,0.005399135458558662,8,7,460.0,0.17077440549619957,0.2684799147033165,37.67815037312168,0.8144050295942091,COMPLETE
325,1.754166114485049,2026-02-13 20:38:05.872117,2026-02-13 20:38:34.933669,0 days 00:00:29.061552,0.5924786491288805,371,8.82842891932535,lossguide,0.0053807147533763205,8,7,470.0,0.15992120520338773,0.2339061886992161,41.21441173188113,0.8161296379968369,COMPLETE
326,1.7536037473467287,2026-02-13 20:38:09.633487,2026-02-13 20:38:38.579967,0 days 00:00:28.946480,0.5925058786645568,800,8.816530428731069,lossguide,0.0052876219986354445,8,7,353.0,0.1670581079132373,0.4184529266982544,38.90261877069224,0.8130709236037785,COMPLETE
