number,value,datetime_start,datetime_complete,duration,params_colsample_bytree,params_early_stopping_rounds,params_gamma,params_grow_policy,params_learning_rate,params_max_delta_step,params_max_depth,params_max_leaves,params_min_child_weight,params_reg_alpha,params_reg_lambda,params_subsample,state
163,1.7555204828278907,2026-02-12 23:50:49.156918,2026-02-12 23:51:13.805101,0 days 00:00:24.648183,0.5127340558346569,740,8.156613024577041,lossguide,0.0057736856552674624,7,6,47.0,3.480766327590283,1.247824930527076,30.532496195497103,0.8400626794829432,COMPLETE
164,1.787430162367155,2026-02-12 23:50:51.646805,2026-02-12 23:51:36.180893,0 days 00:00:44.534088,0.5712355240407945,740,1.9606827249662855,lossguide,0.00686668943510269,7,6,41.0,3.289254399904216,1.7412662813386308,33.03205533371683,0.8394547827199643,PRUNED
165,1.7552041567422865,2026-02-12 23:50:55.380975,2026-02-12 23:51:16.953981,0 days 00:00:21.573006,0.5373758226479857,777,8.129813637934449,depthwise,0.005692262598929611,7,6,,0.3628686264811509,1.0534631288563086,32.55074862329323,0.8383139502283706,COMPLETE
166,1.7546646562877457,2026-02-12 23:50:58.300760,2026-02-12 23:51:21.464071,0 days 00:00:23.163311,0.5786007054121874,749,8.123760897135481,lossguide,0.0067790487027604394,7,6,37.0,2.226781484966058,2.0853554823346228,33.830566208518285,0.839535770464891,COMPLETE
167,1.754558227445809,2026-02-12 23:50:58.413124,2026-02-12 23:51:19.954605,0 days 00:00:21.541481,0.5740446698441912,719,8.118815403020843,depthwise,0.006789248998259382,7,6,,2.1437628466039076,1.698518001984898,80.38824488272346,0.8374465266581809,COMPLETE
168,1.754626519148789,2026-02-12 23:51:00.083339,2026-02-12 23:51:21.329114,0 days 00:00:21.245775,0.5788288803359906,751,7.975753493385189,depthwise,0.006827418944110282,7,6,,3.402512750411363,1.114779232332357,79.31170576303903,0.8462126445110641,COMPLETE
169,1.7547095847473728,2026-02-12 23:51:00.169749,2026-02-12 23:51:22.223388,0 days 00:00:22.053639,0.5685971672248822,749,8.058837919354293,depthwise,0.006612406651562223,7,6,,2.9188447943095572,5.3424283197631555,80.2419494221985,0.8405666844549786,COMPLETE
170,1.754799775604984,2026-02-12 23:51:08.759508,2026-02-12 23:51:29.431460,0 days 00:00:20.671952,0.5743903758737456,748,8.082427900011767,depthwise,0.00690134395034208,7,6,,0.2661498501386883,1.2640715219708762,75.84985110768868,0.8402902967723843,COMPLETE
171,1.7547504153476001,2026-02-12 23:51:13.868983,2026-02-12 23:51:34.425949,0 days 00:00:20.556966,0.5727736454524778,720,8.003173291262414,depthwise,0.00674308658601781,7,6,,2.9940110151155785,0.8559094363683865,76.4768239230722,0.8356896379227722,COMPLETE
172,1.7547719242427602,2026-02-12 23:51:17.044600,2026-02-12 23:51:38.218145,0 days 00:00:21.173545,0.5753219264143558,751,8.378705580546736,depthwise,0.00678344120763441,7,6,,0.2865018809608003,1.928317697473706,78.30423072611231,0.8348510089268251,COMPLETE
173,1.754636631021214,2026-02-12 23:51:20.017901,2026-02-12 23:51:41.088238,0 days 00:00:21.070337,0.5754153955370068,752,8.391315618715009,depthwise,0.006632759765289444,7,6,,2.2240188208422444,1.883584343977988,82.7249794265238,0.8328084361183317,COMPLETE
174,1.754876134434565,2026-02-12 23:51:21.421087,2026-02-12 23:51:43.501461,0 days 00:00:22.080374,0.5727432496575432,754,7.868936811253059,depthwise,0.0068956741916172135,7,6,,2.9831848456184984,1.5730093633342297,83.43235530505515,0.8485046172294508,COMPLETE
175,1.7546643371021948,2026-02-12 23:51:21.541666,2026-02-12 23:51:41.354843,0 days 00:00:19.813177,0.6027722570703791,724,7.80249198139276,depthwise,0.006875759639634134,7,6,,2.96697358084777,1.6203309950849953,76.76632702942986,0.8485255901455709,COMPLETE
176,1.7547451513924082,2026-02-12 23:51:22.284238,2026-02-12 23:51:43.020788,0 days 00:00:20.736550,0.6047403523938456,719,8.726398094273518,depthwise,0.007026772617631304,7,6,,2.233631911508314,0.3080381564254849,43.384231150467265,0.8496003433067985,COMPLETE
177,1.7551177236221365,2026-02-12 23:51:29.498648,2026-02-12 23:51:50.738605,0 days 00:00:21.239957,0.6111882204009147,720,7.830106696637019,depthwise,0.007654411194897123,7,6,,2.199184689370592,0.6958479163927005,46.802580498723266,0.8524938908283403,COMPLETE
178,1.7555950625112187,2026-02-12 23:51:34.505105,2026-02-12 23:51:55.179450,0 days 00:00:20.674345,0.5823824565735942,754,7.793279849744602,depthwise,0.007630083852715009,7,6,,4.578850515825955,2.3706410827061757,42.643956594780164,0.8514734780191624,COMPLETE
179,1.754776107821239,2026-02-12 23:51:36.276715,2026-02-12 23:51:57.657998,0 days 00:00:21.381283,0.5978811838083392,753,7.8192369865905444,depthwise,0.007369794078406282,9,6,,5.104737986147736,1.8258079813117394,88.88887258262983,0.853763615707533,COMPLETE
180,1.755399906299036,2026-02-12 23:51:38.280099,2026-02-12 23:51:59.653383,0 days 00:00:21.373284,0.6041216202847205,716,7.759333407499072,depthwise,0.007294001355092584,9,6,,5.312614045238147,0.5382769547777305,42.167780031036386,0.8526587441725484,COMPLETE
181,1.7556352898554892,2026-02-12 23:51:41.158589,2026-02-12 23:52:02.508985,0 days 00:00:21.350396,0.6002834836346499,719,8.72402045989084,depthwise,0.0073582552732988265,6,6,,2.2089646198523143,0.32826938315293447,44.6225973473185,0.8517186612982041,COMPLETE
182,1.755471401078188,2026-02-12 23:51:41.452248,2026-02-12 23:52:02.382674,0 days 00:00:20.930426,0.6021416379920854,721,7.776246175623962,depthwise,0.007590459794602332,6,6,,4.380017657359649,0.45249588258330564,43.99433885862793,0.8548020981908012,COMPLETE
183,1.7552730151760034,2026-02-12 23:51:43.092323,2026-02-12 23:52:04.853192,0 days 00:00:21.760869,0.5974048994574492,728,7.568268297890458,depthwise,0.007785053855496698,6,6,,5.218542780706635,0.5932382611071232,98.41019024836197,0.8612971369242145,COMPLETE
184,1.7573933337295478,2026-02-12 23:51:43.566366,2026-02-12 23:52:04.384437,0 days 00:00:20.818071,0.6243335483848785,730,7.832073774154091,depthwise,0.00757747660636831,6,6,,4.612353709693441,0.5298823480063813,55.402954016036695,0.8611970057122048,PRUNED
185,1.7554088823629876,2026-02-12 23:51:50.802068,2026-02-12 23:52:12.772709,0 days 00:00:21.970641,0.5943793636760114,735,7.595789814564996,depthwise,0.0074536350854663225,6,6,,10.011139158480416,5.27358926058057,96.04702717293077,0.8596391872717181,COMPLETE
186,1.7563177349237118,2026-02-12 23:51:55.264757,2026-02-12 23:52:16.546654,0 days 00:00:21.281897,0.6264071965168487,732,7.570476021540443,depthwise,0.007254268120178133,6,6,,5.001029988579684,0.6296297988898818,56.3360160407803,0.8611924081391505,COMPLETE
187,1.7554205754110261,2026-02-12 23:51:57.743247,2026-02-12 23:52:18.994889,0 days 00:00:21.251642,0.5960102885391552,733,7.605877223601281,depthwise,0.008164134319927628,6,6,,3.776245477952728,0.4819587719671639,55.05111513019612,0.8611918815213176,COMPLETE
188,1.7554824718223898,2026-02-12 23:51:59.717418,2026-02-12 23:52:21.394940,0 days 00:00:21.677522,0.6240244346126066,735,8.391772081698443,depthwise,0.006454488671413647,6,6,,1.8998293922400034,5.9380263604466865,54.79107120673981,0.8626301216848383,COMPLETE
189,1.755134429000127,2026-02-12 23:52:02.450979,2026-02-12 23:52:24.520055,0 days 00:00:22.069076,0.6201012965491222,734,8.374295159557265,depthwise,0.0065510764313688775,6,6,,3.7613357415388777,5.2924977798432575,55.83294712199823,0.8276069728243267,COMPLETE
190,1.7557497617117601,2026-02-12 23:52:02.603904,2026-02-12 23:52:26.165637,0 days 00:00:23.561733,0.6256059517859187,733,7.5044996467782665,depthwise,0.006530753300517648,6,6,,1.888605851448711,5.3339604484868675,57.93598294014586,0.8273028308927605,COMPLETE
191,1.7546003924588331,2026-02-12 23:52:04.456744,2026-02-12 23:52:27.711790,0 days 00:00:23.255046,0.5604244819984536,774,8.29793735128415,depthwise,0.006613770838354003,7,6,,1.8823804227766812,5.653920384331159,66.77576510382833,0.8293785878974413,COMPLETE
192,1.7681693459231684,2026-02-12 23:52:04.916806,2026-02-12 23:52:22.888913,0 days 00:00:17.972107,0.5830432914932363,799,8.326557823775628,depthwise,0.0755395009795928,7,6,,1.9432765042114197,5.5985250146110594,68.67319778940399,0.8289007457494012,PRUNED
193,1.7550372954610949,2026-02-12 23:52:12.858920,2026-02-12 23:52:35.435058,0 days 00:00:22.576138,0.5613605753734466,800,8.324195247112119,depthwise,0.006445590973187425,7,6,,1.8404436749084006,4.971599699800528,66.20014568183923,0.8290414669086011,COMPLETE
194,1.754985299700778,2026-02-12 23:52:16.632288,2026-02-12 23:52:38.529158,0 days 00:00:21.896870,0.5844961765400565,779,8.324264288101052,depthwise,0.0063850504807003525,7,6,,1.9654603026346025,4.9066142934253305,67.82207319954124,0.8280306014561502,COMPLETE
195,1.754569315812272,2026-02-12 23:52:19.080679,2026-02-12 23:52:42.415881,0 days 00:00:23.335202,0.5603464536031817,799,8.417869141279338,depthwise,0.0065185357099795385,7,6,,1.8216326725334733,5.289410582493526,67.91342200369165,0.7940139950363739,COMPLETE
196,1.7551807030713298,2026-02-12 23:52:21.456944,2026-02-12 23:52:44.360507,0 days 00:00:22.903563,0.5631681107076553,799,8.250234681291953,depthwise,0.006497958002373367,7,6,,2.9372451318174,2.5016051614180967,67.79363965368297,0.8271934748166743,COMPLETE
197,1.7544057213456035,2026-02-12 23:52:22.959201,2026-02-12 23:52:45.842098,0 days 00:00:22.882897,0.5658451233631233,776,8.960128318286214,depthwise,0.006549292429972898,7,6,,2.8956425386540863,2.420719632484387,69.39319198690193,0.7980403286174086,COMPLETE
198,1.7549168282905734,2026-02-12 23:52:24.605592,2026-02-12 23:52:47.944545,0 days 00:00:23.338953,0.5616005707504219,779,8.16881502662672,depthwise,0.005890600570795363,8,6,,2.8858512830991376,2.323663735927366,71.6818263934489,0.8079602557484858,COMPLETE
199,1.7552837898569968,2026-02-12 23:52:26.230833,2026-02-12 23:52:48.326990,0 days 00:00:22.096157,0.5646912869671371,699,8.187097779506892,depthwise,0.005899633085272586,8,6,,2.8374927070647873,2.4762616661177566,75.02640061413841,0.8807854124271062,COMPLETE
200,1.7545215858443544,2026-02-12 23:52:27.775175,2026-02-12 23:52:51.309269,0 days 00:00:23.534094,0.5641948256590189,780,8.648586972366003,depthwise,0.005930775199635524,7,6,,2.912368142447227,2.3679055649949032,70.14662923999958,0.8017419212990887,COMPLETE
201,1.755501034540458,2026-02-12 23:52:35.495535,2026-02-12 23:52:58.817987,0 days 00:00:23.322452,0.5625213527324308,777,8.943684277963442,depthwise,0.005887645813392029,7,6,,2.857122156866987,2.4037141986888475,72.00030142920266,0.8065812234159666,COMPLETE
202,1.7543079373479507,2026-02-12 23:52:38.615586,2026-02-12 23:53:00.634494,0 days 00:00:22.018908,0.5617482215465781,778,8.98470496738031,depthwise,0.005960825838624164,8,6,,3.0179724975828846,2.3344599431100126,37.23242730694129,0.7980355064521318,COMPLETE
203,1.755071728456521,2026-02-12 23:52:42.505131,2026-02-12 23:53:05.324302,0 days 00:00:22.819171,0.5595748122107471,776,8.953523359890355,depthwise,0.00587233530906403,8,6,,2.865600549151086,9.267064162833588,75.48687273922268,0.7976778915696503,COMPLETE
204,1.7547453095609302,2026-02-12 23:52:44.424948,2026-02-12 23:53:07.120651,0 days 00:00:22.695703,0.560497181516464,777,8.997041614653018,depthwise,0.006020794952061019,8,6,,0.37891691949576656,8.718171403176111,79.76390928409867,0.7973081112844712,COMPLETE
205,1.7550694637638962,2026-02-12 23:52:45.907887,2026-02-12 23:53:09.324526,0 days 00:00:23.416639,0.5590511503099753,774,8.875184204113863,depthwise,0.005875168302652658,8,6,,1.4331563627648884,7.928059410571048,74.11903724604284,0.7967250533589411,COMPLETE
206,1.7691810501994336,2026-02-12 23:52:48.011011,2026-02-12 23:53:09.460585,0 days 00:00:21.449574,0.5597893737528673,773,8.921952149668721,depthwise,0.00552932553290174,8,3,,3.764640151113545,9.930090540770745,79.60790535129645,0.7964574578370253,PRUNED
207,1.7716751087215938,2026-02-12 23:52:48.392675,2026-02-12 23:53:09.520241,0 days 00:00:21.127566,0.5398074389043123,775,8.944304582169574,depthwise,0.005771068038518101,7,3,,3.9337119306955293,9.20914614893008,0.032890458492044874,0.7887349210446793,PRUNED
208,1.754591318378203,2026-02-12 23:52:51.373417,2026-02-12 23:53:14.515551,0 days 00:00:23.142134,0.5418180338847918,775,8.977837522493632,depthwise,0.005556254674850982,7,6,,1.3895947308438117,9.485503689752177,81.18041857008656,0.7976054132604588,COMPLETE
209,1.7548704143348541,2026-02-12 23:52:58.903219,2026-02-12 23:53:22.122095,0 days 00:00:23.218876,0.5493700721518804,772,8.678878114464284,depthwise,0.005537321728023402,7,6,,0.35268648159067223,9.162173577723586,49.34348311981781,0.7917252640867501,COMPLETE
210,1.7546195577205845,2026-02-12 23:53:00.697904,2026-02-12 23:53:23.020068,0 days 00:00:22.322164,0.5403444774270998,772,9.021997333364052,depthwise,0.005525983302688321,8,6,,3.3743800968672257,9.69900454319377,48.72541323026626,0.7933592405316491,COMPLETE
211,1.754367592786596,2026-02-12 23:53:05.412538,2026-02-12 23:53:28.256460,0 days 00:00:22.843922,0.5393777731273469,770,8.66329590954494,depthwise,0.005504010927502632,8,6,,0.3599610801235467,9.873402103003032,50.54718763472044,0.800882643986388,COMPLETE
212,1.7682986989915483,2026-02-12 23:53:07.207511,2026-02-12 23:53:28.450256,0 days 00:00:21.242745,0.5411600784798307,766,8.698273074716628,depthwise,0.00556510439684034,8,3,,3.76344978767776,9.903700125954702,45.58955286584582,0.791255206520417,PRUNED
213,1.7578934315133474,2026-02-12 23:53:09.445589,2026-02-12 23:53:32.800113,0 days 00:00:23.354524,0.5423612853456239,788,8.700536155398082,depthwise,0.005520218636908606,8,6,,3.836552213834301,9.88266428312641,0.029520963173214246,0.7897686661660106,PRUNED
214,1.7554226152815728,2026-02-12 23:53:09.564779,2026-02-12 23:53:33.446896,0 days 00:00:23.882117,0.5326465034183461,786,8.66997655235137,depthwise,0.005348011827965653,7,6,,3.221346567625115,3.7260825922982077,49.71557899352892,0.767339469867346,COMPLETE
215,1.7551238188101637,2026-02-12 23:53:09.571857,2026-02-12 23:53:32.601291,0 days 00:00:23.029434,0.5328050253136537,788,8.619733184041909,depthwise,0.005417784585875731,7,6,,3.3008651897393793,3.5400402796928176,44.870344922294386,0.8125855662562088,COMPLETE
216,1.7545056493454319,2026-02-12 23:53:14.585136,2026-02-12 23:53:38.160618,0 days 00:00:23.575482,0.5429988506522896,790,8.628075951116514,depthwise,0.0054311901036752045,7,6,,2.4161872468630152,3.841871286363245,52.90525853142471,0.7546521227773291,COMPLETE
217,1.7549455857212952,2026-02-12 23:53:22.190719,2026-02-12 23:53:45.633861,0 days 00:00:23.443142,0.5326303048699915,794,8.610103996792718,depthwise,0.005393891864521624,8,6,,3.2826486580431586,3.8292909513675264,40.497684658059526,0.8123671838452214,COMPLETE
218,1.7561068368485528,2026-02-12 23:53:23.108792,2026-02-12 23:53:48.739914,0 days 00:00:25.631122,0.5422725509538209,784,8.610462771672733,depthwise,0.005380976417826329,8,12,,3.2385901683810085,3.2498405015907688,49.249796064656344,0.7655116583195362,PRUNED
219,1.7540553787915922,2026-02-12 23:53:28.359132,2026-02-12 23:53:52.075304,0 days 00:00:23.716172,0.5436944437202574,790,9.255618820990874,depthwise,0.005485084760648671,8,6,,0.13831976245010114,4.101996727091081,41.65130721223069,0.7664546655875525,COMPLETE
220,1.7545478021551675,2026-02-12 23:53:28.605728,2026-02-12 23:53:51.892341,0 days 00:00:23.286613,0.5306489748988283,789,9.245495509481493,depthwise,0.005481166659775706,8,6,,0.18212218909369512,3.922601806778903,58.29292692871309,0.7990798981841527,COMPLETE
221,1.755282130934783,2026-02-12 23:53:32.717401,2026-02-12 23:53:57.740672,0 days 00:00:25.023271,0.5452608251129172,786,9.187062241056964,depthwise,0.005523737002071125,8,6,,0.13660161347382338,4.870681547970219,60.563555476247515,0.7711219654215169,COMPLETE
222,1.7550078803685791,2026-02-12 23:53:32.956575,2026-02-12 23:53:56.288547,0 days 00:00:23.331972,0.5309862498705177,790,9.09798052203232,depthwise,0.0061787214660472736,9,6,,2.4062952173108365,4.493209343069744,58.82486982345121,0.7744210577423497,COMPLETE
223,1.755327595762338,2026-02-12 23:53:33.545511,2026-02-12 23:53:55.389274,0 days 00:00:21.843763,0.5144680237162644,762,9.164167347485114,depthwise,0.006194531905896773,9,6,,0.6725943206450673,5.925321553978465,59.48396382741028,0.8099746691919039,COMPLETE
224,1.7551622060646714,2026-02-12 23:53:38.225528,2026-02-12 23:54:01.106984,0 days 00:00:22.881456,0.5491087297712237,797,9.20017817768811,depthwise,0.006243396319625571,9,6,,0.7054396523030446,4.307215635733813,60.090274914550314,0.7491849235119393,COMPLETE
225,1.76026444831179,2026-02-12 23:53:45.720349,2026-02-12 23:54:06.091673,0 days 00:00:20.371324,0.5470087513894949,762,9.212885500737915,depthwise,0.02627576295060179,9,6,,0.17726280390597468,5.879324173280665,59.17448724110639,0.7612627756461033,PRUNED
226,1.7559664734641274,2026-02-12 23:53:48.806314,2026-02-12 23:54:13.397061,0 days 00:00:24.590747,0.5518181183251544,800,9.196585743843167,depthwise,0.006041223148501764,9,6,,0.1320630760206271,5.523699692644603,61.44231140525728,0.7067292800885085,PRUNED
227,1.7556738366810354,2026-02-12 23:53:51.983942,2026-02-12 23:54:16.851197,0 days 00:00:24.867255,0.5140927138595146,796,9.206209919917484,depthwise,0.0061194152407520646,9,6,,0.14467462648514492,6.18968301056314,35.64989447939606,0.7548924931944075,COMPLETE
228,1.7553150617615008,2026-02-12 23:53:52.189061,2026-02-12 23:54:15.344403,0 days 00:00:23.155342,0.5190499122633903,797,9.199797471577025,depthwise,0.006170052528296109,9,6,,0.16854691630499197,5.308371406862973,59.97788077286492,0.7758489658880733,COMPLETE
229,1.7551560698539703,2026-02-12 23:53:55.473180,2026-02-12 23:54:18.995167,0 days 00:00:23.521987,0.513730757598838,798,9.28645109813514,depthwise,0.0061087466467488714,8,6,,0.1372546948621301,4.652841565175119,37.81719290705023,0.752943040890255,COMPLETE
230,1.7549498004321684,2026-02-12 23:53:56.374910,2026-02-12 23:54:19.714311,0 days 00:00:23.339401,0.511618131743184,797,9.258918175077243,depthwise,0.005659798144740352,8,6,,0.18768446696816043,6.203165777024083,36.56466530667865,0.7506447051470362,COMPLETE
231,1.7566995393514822,2026-02-12 23:53:57.807709,2026-02-12 23:54:21.120588,0 days 00:00:23.312879,0.5203995427582236,798,9.361476689771214,depthwise,0.005859240782489051,1,6,,0.10651010332176278,6.47497384987397,34.68441800045518,0.7835283050003127,PRUNED
232,1.756649429491445,2026-02-12 23:54:01.171764,2026-02-12 23:54:24.736713,0 days 00:00:23.564949,0.5227349516150449,759,9.30858680243167,depthwise,0.005790853207902482,1,6,,0.1373610057578186,6.509316375607969,34.0414034515566,0.7847177971750047,PRUNED
233,1.7572185198011046,2026-02-12 23:54:06.158897,2026-02-12 23:54:30.035516,0 days 00:00:23.876619,0.5105855607699056,760,9.376644492392868,depthwise,0.005806217990775377,1,6,,0.12434814614467726,2.745922072856149,27.493056650065437,0.7417214143906452,PRUNED
234,1.7702118760639474,2026-02-12 23:54:13.453701,2026-02-12 23:54:44.965254,0 days 00:00:31.511553,0.5255587505886288,800,3.8243627848766475,depthwise,0.005739209122292108,1,6,,0.18248799006897465,2.89586174479891,35.0745776421696,0.8025177066652421,PRUNED
235,1.7734191057760795,2026-02-12 23:54:15.408267,2026-02-12 23:54:48.573239,0 days 00:00:33.164972,0.5117899026142292,763,4.028632662161293,depthwise,0.005770151029156401,1,6,,0.19246745271359544,1.3346622189337847,35.72726958349771,0.7570990020682448,PRUNED
236,1.754134037242581,2026-02-12 23:54:16.916037,2026-02-12 23:54:39.373797,0 days 00:00:22.457760,0.5275294590247377,760,9.357211276435208,depthwise,0.005747472730548101,8,7,,0.12746233688851827,1.4175632044918864,27.50945246812742,0.7400789012015512,COMPLETE
237,1.756598405185039,2026-02-12 23:54:19.065873,2026-02-12 23:54:44.872386,0 days 00:00:25.806513,0.5272298469489725,761,8.855988384759488,depthwise,0.005776563053823793,1,7,,0.1109951124284929,2.8902371315428996,32.83760376248198,0.7427215234957505,PRUNED
238,1.759273845083889,2026-02-12 23:54:19.805948,2026-02-12 23:54:41.783952,0 days 00:00:21.978004,0.5705145211834618,758,8.474234122269806,depthwise,0.005778996165588738,7,6,,0.11594888900723141,2.7033328818334725,0.9720664232763586,0.8037345808832053,PRUNED
239,1.7549639609125152,2026-02-12 23:54:21.213873,2026-02-12 23:54:42.653319,0 days 00:00:21.439446,0.5682603380356973,766,8.510703406971492,depthwise,0.0057056334148898975,7,6,,0.20794117568316703,3.160625883218843,49.14556739052763,0.8064670916423111,COMPLETE
240,1.7677983816742586,2026-02-12 23:54:24.805239,2026-02-12 23:54:56.869214,0 days 00:00:32.063975,0.5674921951045404,781,3.890530606111507,depthwise,0.0052769563891072865,7,6,,0.11679407017922791,2.8603597521408797,51.143589856574565,0.804058041254768,PRUNED
241,1.7546540400499153,2026-02-12 23:54:30.105176,2026-02-12 23:54:53.591013,0 days 00:00:23.485837,0.5540473424109176,782,8.752876363629712,depthwise,0.005261916987213294,7,6,,0.22589384548269956,1.2940774367208514,47.95198171706535,0.8027194558653516,COMPLETE
242,1.758060404916611,2026-02-12 23:54:39.461419,2026-02-12 23:55:02.303619,0 days 00:00:22.842200,0.5300990146104629,783,8.835946230828949,depthwise,0.005231042524993707,8,7,,0.11208697303089056,2.7892281108361305,0.20978114056079689,0.8085403111985378,PRUNED
243,1.75441056211611,2026-02-12 23:54:41.864877,2026-02-12 23:55:05.587445,0 days 00:00:23.722568,0.5266305340828792,781,9.011201763017853,depthwise,0.005292937756593203,8,7,,0.20163418046553253,1.3084662405195913,25.632771821584925,0.8041719764180489,COMPLETE
244,1.753755423590081,2026-02-12 23:54:42.711301,2026-02-12 23:55:07.391307,0 days 00:00:24.680006,0.5298616098796662,781,9.04043815123617,depthwise,0.005232892915970412,8,7,,0.11600122296157059,1.4706341577186688,26.383598521713406,0.7349635705972555,COMPLETE
245,1.7535767021915272,2026-02-12 23:54:44.955542,2026-02-12 23:55:08.710443,0 days 00:00:23.754901,0.5516389173043015,782,8.861568818158077,depthwise,0.005350880193386895,8,7,,2.6650651514585664,1.45731953846633,41.68082796478562,0.8192925833925692,COMPLETE
